Song,Film,YearMusic Director,Lyricist,Singers
"अच्छा उन्हें देखा है, बीमार हुई आँखें
मुरझाई-सी रहती है, घबराई-सी रहती हैं
माशूक़ों की महफ़िल में शर्माई-सी रहती हैं
क्या जाने हुआ क्या है, पथराई-सी रहती हैं
अच्छा उन्हें देखा है, बीमार हुई आँखें

शोख़ी भी लुटा बैठीं मस्ती भी गँवा बैठीं
उठती हैं न झुकती हैं, क्या रोग लगा बैठीं
ए यार, क्या रोग लगा बैठीं कि बीमार हुई आँखें
अच्छा उन्हें देखा है, बीमार हुई आँखें

किस तरह हटे दर से, वादा है सितमगर से
कहती है लगन दिल की, वो चल भी चुके घर से
है फ़ासला दम भर का, फिर देख समाँ घर का
वो हिलने लगी चिलमन, वो पर्दा-ए-दर सरका
लो आ ही गया कोई, ए यार, लो आ ही गया कोई
लो आ ही गया कोई जो चार हुई आँखें 
सरशार हुई आँखें, सरशार हुई आँखें
अच्छा उन्हें देखा है, बीमार हुई आँखें

वो नक़ाब रुख़ से उठाए क्यों
वो बहार-ए-हुस्न लुटाए क्यों
सर-ए-बज़्म जलवा दिखाए क्यों
तुम्हें अँखियों से पिलाए क्यों
कि वो अपने नशे में चूर है

जो नशे में चूर रहे सदा
उसे तेरी हाल का क्या पता
रहा यूँ ही दिल का मुआमला
मगर उसकी कोई नहीं ख़ता
तेरी आँख का ये क़सूर है, आँखों पे पड़ा पर्दा
ए यार, आँखों पे पड़ा पर्दा, लाचार हुई आँखें
अच्छा उन्हें देखा है, बीमार हुई आँखें

हमने आज एक ख़्वाब देखा है
ख़्वाब भी लाजवाब देखा है
कोई ताबीर इसकी बतलाओ
रात को आफ़्ताब देखा है

यानी ज़िंदा शराब देखोगे
हुस्न को बे-नक़ाब देखोगे
रात को आफ़ताब देखा है
सुबह को माहताब देखोगे
चाँदनी में उठी घटा जैसे
दर-ए-मैख़ाना खुल गया जैसे
ये फ़साना सही हसीं तो है
नशे में रच गई अदा जैसे

कोई तुमसा भी हो न दीवाना
तुम हक़ीक़त को समझे अफ़साना
चाँदनी उसका रंग, ज़ुल्फ़ घटा
और वो आँखें हैं बाद-ए-मैख़ाना
मैख़ाने में पहुँची तो, ए यार, मैख़ाने में पहुँची तो
मैख़्वार हुई आँखें, गुलनार हुई आँखें 
अच्छा उन्हें देखा है, बीमार हुई आँखें

सुनते हैं उस दर पे जाके सर झुकाना मना है
सर झुका भी लें अगर तो बैठ जाना मना है
बैठ भी जाएँ किसी कोने में तो क्या फ़ायदा
जिस तरफ़ वो हों उधर नज़रें उठाना मना है
और अगर नज़रें उठें तो दर्द-ए-दिल को क्या करें
दर्द-ए-दिल कैसे मिटे आँसू बहाना मना है
और अगर आँसू बहाएँ भी तो वो देखेंगे क्यों
आह भरना शोर करना गुल मचाना मना है
गुल मचाया भी तो मतलब किस तरह समझेंगे वो
हाय्! मतलब साफ़-साफ़ उन को बताना मना है
और अगर मतलब बताया तो भी तो वो देंगे जवाब
दिल लगाया तुम ने क्यों जब दिल लगाना मना है

दिल का न कहा माना, ए यार, दिल का न कहा माना
दिल का न कहा माना, ग़द्दार हुई आँखें
अच्छा उन्हें देखा है, लाचार हुई आँखें
लाचार हुई आँखें, मैख़्वार हुई आँखें
अच्छा उन्हें देखा है, मैख़्वार हुई आँखें
मैख़्वार हुई आँखें, गुलनार हुई आँखें
अच्छा उन्हें देखा है, गुलनार हुई आँखें
गुलनार हुई आँखें, सरशार हुई आँखें
अच्छा उन्हें देखा है, सरशार हुई आँखें
अच्छा उन्हें देखा है

 ",Shankar Hussain,1977,Khayyam,Kaifi Azmi,"Aziz Nazan, Babban Khan, chorus"
"कि: अच्छी नहीं सनम दिल्लगी दिल-ए-बेक़रार से
आ: क्यों रो रहे हो छेड़ा था हमने तुमको तो प्यार से
कि: खेल ही खेल में जाएगी एक जान
आ: क्यों रो रहे हो छेड़ा था हमने तुमको तो प्यार से
कि: अच्छी नहीं सनम दिल्लगी दिल-ए-बेक़रार से
आ: प्यार के खेल में कैसा दिल क्या जान
कि: अच्छी नहीं सनम दिल्लगी दिल-ए-बेक़रार से

कि: कहते हो तुम तो यूँ ही सही कि ऐ मेरे हसीन
आ: आ हाहाहा...
कि: सारी ख़ता जवानी की है, क़ुसूर आपका नहीं
    कर जाते हो शरारत जब मिलते हो प्यार से
आ: क्यों रो रहे हो छेड़ा था हमने तुमको तो प्यार से
कि: अच्छी नहीं सनम दिल्लगी दिल-ए-बेक़रार से
 
आ: छेड़ूँ अगर तो शिकवा करो, न छेड़ूँ तो ग़िला
    लगता है यूँ कि तुम आज से दीवाने हुए पीया
    होने लगे ज़रा में जो बे-इख़्तियार से
कि: अच्छी नहीं सनम दिल्लगी दिल-ए-बेक़रार से
आ: क्यों रो रहे हो छेड़ा था हमने तुमको तो प्यार से

 ",Rakhi Aur Hathkadi,1972,R D Burman,Majrooh,"Kishore, Asha"
"हाँ आँ आँ
अदा क़ातिल नज़र बर्क़-ए-बला
यूँ भी है और यूँ भी
बला
यूँ भी है और यूँ भी
मोहब्बत करने वालों की क़ज़ा
यूँ भी है और यूँ भी
क़ज़ा
यूँ भी है और यूँ भी

आ
आ
( कभी चिलमन उठा देना
कभी चिलमन गिरा देना ) -2
कभी चिलमन गिरा देना
सितमगर नाज़नीनों की अदा
यूँ भी है और यूँ भी
अदा
यूँ भी है और यूँ भी

आ
आ
( हमें चाहा तो क्यूँ चाहा
हमें भूले तो क्यूँ भूले ) -2
हमें भूले तो क्यूँ भूले -2
हाय
सज़ा हम क्यूँ न दे उनकी ख़ता
यूँ भी है और यूँ भी
( ख़ता
यूँ भी है और यूँ भी ) -2

अदा क़ातिल नज़र बर्क़-ए-बला
यूँ भी है यूँ भी बला
यूँ भी है और यूँ भी

 ",Ghazal,1964,Madan Mohan,Sahir,Asha
"अदाएं भी हैं मुहब्बत भी है
शराफ़त भी है मेरे महबूब में
वो दीवानापन वो ज़ालिम अदा
शराफ़त भी है ...

वो दीवानापन वो मासूमियत
शरारत भी है ...

न पूछो मेरा दिल कहां खो गया
तुझे देखते ही तेरा हो गया
आँखों में तू है मेरे ख़्वाबों में तू है
यादों के महके गुलाबों में तू है
वो सहमी नज़र वो कमसिन नज़र
चाहत भी है मेरे महबूब में

साँसों की बहकी लहर रुक गई
मुझे शर्म आई नज़र झुक गई
कि हम उनके कितने करीब आ गए
थे सोच के हम तो घबरा गए
वो बाँकपन वो दीवानगी
इनायत भी है मेरे महबूब में
वो दीवानापन वो ज़ालिम अदा ...

मुहब्बत की दुनिया बसाने चला
मैं तेरे लिए सब भुलाने चला
ख़ुश्बू कोई उसकी बातों में है
हर फ़ैसला उसके हाथों में है
वो महका बदन वो शर्मिलापन
नज़ाकत भी है मेरे महबूब में
वो दीवानापन वो ज़ालिम अदा ...

 ",Dil Hai Ki Maantaa Naheen,1991,Nadeem-Shravan,Sameer,"Anuradha Paudwal, Kumar Sanu"
"अफ़सान लिख रही हूँ (2) दिल-ए-बेक़रार का 
आँखोँ में रंग भर के तेरे इंतज़ार का
अफ़साना लिख रही हूँ
 
जब तू नहीं तो कुछ भी नहीं है बहार में
नहीं है बहार में
जी चाहता है मूँह भी
जी चाहता है मूँह भी न देखूँ बहार का
आँखोँ में रन्ग भर के तेरे इंतज़ार का
अफ़साना लिख रही हूँ
 
हासिल हैं यूँ तो मुझको ज़माने की दौलतें
ज़माने की दौलतें
लेकिन नसीब लाई 
लेकिन नसीब लाई हूँ इक सोग़वार का
आँखोँ में रन्ग भर के तेरे इंतज़ार का
अफ़साना लिख रही हूँ
 
आजा कि अब तो आँख में आँसू भी आ गये
आँसू भी आ गये
साग़र छलक उठा 
साग़र छलक उठा मेरे सब्र-ओ-क़रार का
आँखोँ में रन्ग भर के तेरे इंतज़ार का
अफ़साना लिख रही हूँ
 

 ",Dard,1947,Naushad,Shakeel,Uma Devi
"अफ़्फ़ू खुदाया!

वाह-वाह-वाह-वाह, वाह-वाह-वाह-वाह
इस दीवाने दिल ने क्या जादू चलाया
तुमको हमपे प्यार आया, प्यार आया
ओय, हमको तुमपे प्यार आया, प्यार आया
अफ़्फ़ू खुदाया!

जी दिया मैं ने, जी लिया मैं ने
अब चाहे मुझको ज़माना गोली मार दे
राजा के शिकारे को भँवर में उतार दे
आगे जी के क्या लेना है
मेरे दिल ने जो भी माँगा था वो पाया
तुमको हमपे प्यार आया, प्यार आया
अफ़्फ़ू खुदाया!

दिल में ये आई, देके दुहाई
पत्थरों से सर टकराऊँ मैं दीवाना
जल जाऊँ बनके शमा का परवाना
मरना-जीना, खाना-पीना, हँसना-रोना
नहाना-धोना, सोना-उठना, चलना-फिरना
आना-जाना हम दीवाने ने मुहब्बत में भुलाया
हमको तुमपे प्यार आया, प्यार आया
अफ़्फ़ू खुदाया!


 ",Jab Jab Phool Khile,1965,Kalyanji-Anandji,Anand Bakshi,Rafi
"अब जो किए हो दाता ऐसा न कीजो (2)
अगले जनम मोहे बिटिया न कीजो (3)

जो अब किए हो दाता ऐसा न कीजो
अगले जनम मोहे बिटिया न कीजो
जो अब किए ...

हमरे सजनवा हमरा दिल ऐसा तोड़िन
ऊ घर बसाइन हमका रस्ता मा छोड़िन
जैसे कि लल्ला कोई खिलोना जो पावे
दुई-चार दिन तो खेले फिर भूल जावे
रो भी न पावे ऐसी गुड़िया न कीजो
अगले जनम मोहे ...

ऐसी बिदाई बोलो देखी कहीं है
मैया न बाबुल भैया कौनो नहीं है
हो ...
आँसु के गहने हैं और दुःख है डोली
बंद किवड़िया मोरे घर की ये बोली
इस ओर सपनों भी आया न कीजो
अगले जनम मोहे ...

जो अब किए हो दाता ऐसा न कीजो (2)
अगले जनम मोहे बिटिया न कीजो
जो अब किए ...

कैसा नसीबा जग में हर बिटिया पाए
अपना जिन्हें समझत है बने ऊ पराए
बाबुल का अँगना छूटा, मैया का अँचरा
भोली चिरैया पावे बस एक पिंजरा
फिर भी ये सब समझावे तड़पा न कीजो
जो अब किए हो दाता ऐसा न कीजो
अगले जनम मोहे ...


 ",Umrao Jaan,2006,Anu Malik,Javed Akhtar,Richa Sharma/Anmol Malik
"मुकुल:
(अगर आसमाँ तक मेरा हाथ जाता)-3
तो माथे पे चंदा की बिंदिया लगाता
तेरी माँग तारों से मैं सजाता

अल्का:
अगर आसमाँ तक मेरा हाथ जाता
तो मैं चाँदनी से भी सेहरा बनाती
मोहब्बत की धड़कन से उसको सजाती
मैं ख़ुद अपने हाथों से तुझको पहनाती
अगर आसमाँ तक मेरा हाथ जाता

मुकुल:
अगर आसमाँ तक मेरा हाथ जाता

मुकुल:
मेरे पास दिल के सिवा कुछ नहीं है
अल्का:
ज़माने में दिल से बड़ा कुछ नहीं है
मुकुल:
तो फिर आ तुझे अपने दिल में बसा लूँ
अल्का:
(तुझे अपने हाथों की रेखा बना लूँ)-2
(अगर ये समंदर मेरे बस में होता)-2
मोहब्बत का मोती मैं इस में से लाती
सुन मेरे साजन सुन मेरे साथी

मुकुल:
(अगर आसमाँ तक मेरा हाथ जाता)-2

अल्का:
अगर तुझसे बिछड़ूँ तो मर जाऊँ सनम
मुकुल:
क़सम तुझको मेरी ना बोल ऐसा हमदम
अल्का:
क्या है तमन्ना तेरी मेरे साजन
मुकुल:
रहूँ तेरे दिल में तेरी बन के धड़कन
अल्का:
रहूँ तेरे दिल में तेरी बन के धड़कन
मुकुल:
(अगर ये जहाँ मेरी मुट्ठी में आता)-2
तो तुझ पर से क़ुर्बान कर के लुटाता
तेरी माँग तारों से मैं सजाता

(मुकुल:
अगर आसमाँ तक मेरा हाथ जाता
अल्का:
अगर आसमाँ तक मेरा हाथ जाता)-2

 ",Naaraaz,1994,Annu Malik,Rahat Indori,Kumar Sanu
"अगर बेवफ़ा, तुमको पहचान जाते
ख़ुदा की क़सम हम मुहब्बत न करते
जो मालूम होता, ये इलज़ाम-ए-उलफ़त
तो दिल को लगाने की ज़ुर्रत न करते

जिन्हें तुमने समझा मेरी बेवफ़ाई
मेरी ज़िन्दगी की वो मजबूरियाँ थीं
हमारी मुहब्बत इक इम्तिहां थी
ये दो दिन की थोड़ी सी जो दूरियाँ थीं
अगर सच्ची होती मुहब्बत हमारी
तो घबरा के तुम यूँ शिकायत न करते

जो हम पर है गुज़री हमीं जानते हैं
सितम कौन सा है नहीं जो उठाया
निगाहों में फिर भी रही तेरी सूरत
हर एक सांस में तेरा पैगाम आया
अगर जानते तुम ही इलज़ाम दोगे
तो भूले से भी हम तो उलफ़त न करते

 ",Raat Ke Andhere Mein,1969,Prem Dhawan,Prem Dhawan,Rafi/ Lata
"अगर दिल के तारों पे मैं छेड़ सकता
नई ज़िंदगी का नया सा तराना
अगर दिल के तारों पे

न मंज़िल की चाहत मेरे दिल में होती (2)
मेरी प्यास उल्फ़त के नग़्मों को खोती
मेरे नक़्श-ए-पा ही
मेरे नक़्श-ए-पा ही बताते ठिकाना
अगर दिल के तारों पे

मैं लहरों के हाथों में पतवार देकर
जो बसते हैं दिल में उन्हें साथ लेकर
बहुत दूर साहिल से ले जाता कश्ती
न वो रहते वो और न मैं मेरी हस्ती (2)
मगर हाए
अधूरा रहेगा अब अपना फ़साना

नई ज़िंदगी का नया सा तराना (2)
अगर दिल के तारों पे

 ",Ratnadeep,1952,Robin Chatterjee,nan,Talat Mahmood
"अगर दिल किसी से लगाया न होता
ज़माने ने हमको मिटाया न होता
अगर दिल किसी से ...

गिराना ही था तूने ( आँसू समझ के ) -2
तो नज़रों में हमको बसाया न होता
अगर दिल किसी से ...

मुक़द्दर में गर यही ( रुसवाइयाँ थीं) -2
तो महफ़िल में तेरी मैं आया न होता
अगर दिल किसी से ...

अगर तेरे दामन की ( हसरत न होती ) -2
तो यूँ ज़िन्दगी को मिटाया न होता
अगर दिल किसी से ...

 ",Bada Admi,1961,Chitragupt,Prem Dhawan,Rafi
"अगर दिलबर की रुस्वाई हमें मंज़ूर हो जाये
(सनम तू बेवफ़ा के नाम से मषूर हो जाये) - 2
अगर दिल्बर की ... हो जाये
सनम ... हो जाये

(हमें फ़ुर्सत नहीं मिलती) - 2
कभी आँसू बहाने से
(कई ग़म पास आ बैठे) -2
(तेरे एक दूर जाने से) - 2
(अगर तू पास आ जाये तो हर ग़म दूर हो जाये) - 2
सनम तू ... हो जाये

(वफ़ा का वास्ता देकर) - 2
मोहब्बत आज रोती है
(न ऐसे खेल इस दिल से) - 2
(ये नज़ुक चीज़ होती है) - 2
(ज़रा सी ठेस लग जाये तो शीशा चूर हो जाये) -2
सनम तू ... हो जाये

(तेरे रंगीन होंठों को) - 2
कमल कहने से डरते हैं
(तेरी इस बेरुख़ी पे हम) - 2
(ग़ज़ल कहने से डरते हैं) - 2
(कहीं ऐसा न हो तू और भी मग़रूर हो जाये) - 2

अगर दिल्बर कि थ्री दोत्स हो जाये
सनम तू ... हो जाये


 ",Khilauna,1970,Laxmikant-Pyarelal,Anand Bakshi,Lata
"अगर किसी से मोहब्बत न की
तो कुछ ना किया
मरे बग़ैर किसी पर
कोई जिया न जिया

( समझ लो नज़र से
समझ लो नज़र से
इशारा किसी का
के दिल चाहता है
सहारा किसी का ) -2
समझ लो नज़र से

नज़र में समाती नहीं कोई सूरत
निगाहों को भाती नहीं कोईइ मूरत
के देखा है जब से -2
नज़ारा किसी का

के दिल चाहता है
सहारा किसी का
समझ लो नज़र से -2

मुहब्बत के बदले में ईमान ले लो
अगर जान काम आ सके जान ले लो
मगर दिल ना तोड़ो -2
ख़ुदारा किसी का

के दिल चाहता है
सहारा किसी का
समझ लो नज़र से -2

ना रंग-ए-मोहब्बत न बू-ए-वफ़ा है
ग़ज़ब है के ऐसों से पाला आ पड़ा है
समझते नहीं जो -2
इशारा किसी का

के दिल चाहता है
सहारा किसी का
समझ लो नज़र से -2

 ",Kashmir,1951,Hansraj Behl,Sarshar Sailani,Zohra Bai
