Song,Film,YearMusic Director,Lyricist,Singers
"इक लड़की थी दीवानी सी इक लड़के पे वो मरती थी
नज़रें झुका के शरमा के गलियों से गुजरती थी
चोरी चोरी चुपके चुपके चिट्ठियां लिखा करती थी
कुछ कहना था शायद उसको जाने किससे डरती थी
जब भी मिलती थी मुझसे मुझसे पूछा करती थी
प्यार कैसे होता है ये प्यार कैसे होता है
और मैं सिर्फ़ ये ही कह पाता था

आँखें खुली या हों बंद दीदार उनका होता है
कैसे कहूँ मैं ओ यारा प्यार कैसे होता है
हे आँखें खुली या हों बंद ...

तु रु रु रु रु रु रु रु
तु रु रु रु रु रु

आज ही यारों किसी पे मर के देखेंगे हम
प्यार होता है ये कैसे करके देखेंगे हम
किसी की यादों में खोए हुए
ख्वाबों को हमने सजा लिया
किसी की बाहों में सोए हुए
अपना उसे बना लिया
ऐ यार प्यार में कोई ना जागता ना सोता है
कैसे कहूँ मैं ओ यारा ...

क्या है ये जादू है कोई बस जो चल जाता है
तोड़के पहरे हज़ारों दिल से निकल जाता है
दूर कहीं आसमानों पर होते हैं ये सारे फ़ैसले
कौन जाने कोई हमसफ़र कब कैसे कहाँ मिले
जो नाम दिल पे हो लिखा इकरार उसी से होता है
कैसे कहूँ मैं ओ यारा ...

 ",Mohabbatein,2000,Jatin-Lalit,Anand Bakshi,"Lata, Udit Narayan, Udbhav, Ma..."
"ल: आँखें मिलाएंगे बातें सुनाएंगे
    पल्कें बिछाएंगे ज़ुल्फ़ें बिखराएंगे
    फिर किसी दिन
कि: आज क्या करेंगे
ल: हो आज सिर्फ़ गाना गाएंगे
ल: आँखें मिलाएंगे बातें सुनाएंगे
    पल्कें बिछाएंगे ज़ुल्फ़ें बिखराएंगे
    फिर किसी दिन
कि: भइ आज क्या करेंगे
ल: हो आज सिर्फ़ गाना गाएंगे

कि: गाने के लिये यहां आना क्या ज़रूरी था
    जाने के लिये ये बहाना क्या ज़रूरी था
ल: अच्छा मान जाते हैं नहीं तड़पाते हैं
कि: ये बात हुई ना
ल: ल ल ला ला ला ला ला ला
    मिल के लहराएंगे कभी पास आएंगे
    कभी पास आएंगे कभी दूर जाएंगे
    फिर किसी दिन
कि: ओहो आज क्या करेंगे
ल: हो आज सिर्फ़ गाना गाएंगे

कि: प्यार में गिलें शिकवें का मौका देती हो
    घर से बुला के रस्ते में धोखा देती हो
ल: अच्छा चलोठीक है कुछ भी हो प्रीत है
कि: वादा रहा ना
ल: हां वादा   
    ल ल ला ला ला ला ला ला
    प्रीत ये निभाएंगे आँखों में बसाएंगे
    तुम को ना रुलाएंगे हसेंगे हसाएंगे
    फिर किसी दिन
कि: भइ आज क्या करेंगे
ल: हो आज सिर्फ़ गाना गाएंगे

कि: आँखें मिलाएंगे बातें सुनाएंगे
    पल्कें बिछाएंगे ज़ुल्फ़ें बिखराएंगे
    फिर किसी दिन
ल: तो आज क्या करेंगे
कि: आज सिर्फ़ गाना गाएंगे

 ",Bhanwar,1976,R D Burman,Anand Bakshi,"Asha, Kishore"
"आँखें प्यारी हैं बातें प्यारी हैं
पर सबसे प्यारा तेरा दिल है
जो मेरे सीने में धड़कता है धड़कता है
आँखें प्यारी ...

मौक़ा भी है मौसम भी है हैं अरमान मस्ती भरे
होता है जो हो जाने दो हैं ये हालात बदले हुए
तड़पता है मन मेरा मचलता है तन मेरा
हो तेरे प्यार का एक शोला है
जो मेरे सीने में भड़कता है भड़कता है

मुश्क़िल बड़ा कहना है ये मेरी साँसों में तूफ़ान है
रोको नहीं कह दो सनम तुझपे क़ुर्बान ये जान है
नहीं तुम बिन अब गुजारा मेरे दिल का तू सहारा
ओ तेरे प्यार का इक सावन है
जो मेरे सीने में बरसता है बरसता है
आँखें प्यारी ...

 ",Yeh Hai Jalwa,2002,Himesh Reshammiya,Sudhakar Sharma,"Kumar Sanu, Alka Yagnik"
"आँखें तो हुई बन्द मगर, दर्द जगाये
दिल याद में किसीकी ज़रा रोने लगा रे
रोने लगा रे, रोने लगा रे
दिल याद में किसीकी ज़रा रोने लगा रे

दिल में दुखा ख़्वाब है, आँखों में अँधेरा
आँखों में अँधेरा
हो गया बरबाद मेरा रैन बसेरा
रैन बसेरा
अब होके जुदा दोनों, लगे हैं जा किनारे
दिल याद में किसीकी ज़रा रोने लगा रे

इश्क़ किया हुस्न की तस्वीरें बनाईं   -2
छोड़ के तस्वीर एक, बाक़ी मिटाईं  -2
अब जी रहा हूँ मैं, इसी तिनके के सहारे
दिल याद में किसी की ज़रा रोने लगा रे

मिलने की तमन्ना से मुझे चैन नहीं है
दिन रात मेरी प्रीत उसे ढूँढ रही है
आ जाये कहीं वो, मिल जाये कहीं वो  -2
मिल जाये तो रखूँ उसे, पलकों में छुपाये
दिल याद में किसीकी ज़रा रोने लगा रे

 ",Begum,1945,Hariprasanna Das,G S Nepali,Ashok Kumar
"आँखों आँखों में हर इक रात गुज़र जाती है -2
तुम नहीं आते हो तो याद भी क्यों आती है
आँखों आँखों में हर इक रात गुज़र जाती है

हम खयालों में बुला लेते हैं अक्सर तुमको -2
जब तबीयत ज़रा तनहाई से घबराता है  -2
आँखों आँखों में हर इक रात गुज़र जाती है

हर इक आहट पे यूँ हम चौंक उठा करते हैं -2
जिस तरहा बिजली घटाओं में चमक जाती है
तुम नहीं आते हो तो, याद भी क्यों आती है
आँखों आँखों में हर इक रात गुज़र जाती है

 ",Marvel Man,1964,Robin Banerjee,Yogesh,Mubarak Begum
"र : आँखों आँखों में न जाने क्या इशारे हो गए
 मुस्कुरा कर तुमने देखा हम तुम्हारे हो गए
 आँखों आँखों में ...

सु : रात-दिन की बेक़रारी उम्र भर की बेखुदी -2
 दिल लगा कर कुछ तो जीने के सहारे हो गए
 आँखों आँखों में ...

र : हाय ये मासूम चेहरा ये अदा ये बाँकपन -2
 तुझसे मिल के रंग दिल के और प्यारे हो गए
 आँखों आँखों में ...

सु : तुमको पा कर इस जहाँ में हमने सब कुछ पा लिया
र : तुमको पा कर इस जहाँ में हमने सब कुछ पा लिया
दो : अब हमें क्या चाहिए जब तुम हमारे हो गए
 आँखों आँखों में ...

 ",Bedaagh,1965,Roshan,Shakeel,"Rafi, Asha"
"र: (आँखों ही आँखों में इशारा हो गया
बैठे बैठे जीने का सहारा हो गया ) - 2
आँखों ही आँखों में ...

गी: गाते हो गीत क्यूँ, दिल पे क्यूँ हाथ है
खोए हो किस लिये, ऐसी क्या बात है
ये हाल कब से तुम्हारा हो गया

र: आँखों ही ... - 2

गी: चलते हो झूम के, बदली है चाल भी
नैंनों में रंग है, बिखरे हैं बाल भी
किस दिलरुबा का नज़ारा हो गया

र: आँखों ही ... - 2

गी: अब ना वो ज़ोर है, अब ना वो शोर है
हमको है सब पता, दिल में क्या चोर है
ये चोर कब से गवारा हो गया

र: आँखों ही ... - 2

गी: कैसा ये प्यार है, कैसा ये नाज़ है
हम भी तो कुछ सुनें, हमसे क्या राज़ है
अच्छा तो ये दिल हमारा हो गया

र: आँखों ही ... - 2

 ",C.I.D.,1956,O P Nayyar,Jaan Nisar Akhtar,"Rafi, Geeta"
"आँखों का तारा प्राणों से प्यारा 
जुग जुग जिये मेरा लाल रे 
मेरी उमरिया मिल जाये तुझको 
जीत रहे सौ साल रे 
आँखों का तारा प्राणों से प्यारा   ...

पहले बरस मेरा नन्हा सा राजा
कूँ कूँ मूँ मूँ बोले
दूजे बरस बोले रोटी को लोटी
मैय्या का दिल डोले रे 
माँगे खिलौने गाड़ी घोड़े
जबके लगे तीजा साल रे
आँखों का तारा प्राणों से प्यारा   ...

चौथे बरस खेले गिल्ली डण्डा
पैसे माँ से माँगे रे
नटखट राजा माँ को सताये
माँ पीछे वो आगे रे 
होऽ ओऽ ओऽ ओऽ
पाठशाला बाबू बनकर
जाये मेरा लाल रे 
आँखों का तारा प्राणों से प्यारा   ...

खुशियों की किरणें फैलाये जग में
पूनम का चंदा हमारा रे
बोले बाबुल ला दे दुल्हनिया
बेटा जवाहर हमारा रे 
ओ मेरी मैय्या लाल दुशाला
बेटा चला ससुराल रे 
आँखों का तारा प्राणों से प्यारा   ...

 ",Aansoo,1953,Husnlal-Bhagatram,Qamar Jalalabadi,Lata
"आँखों की गुस्ताखियां माफ़ हों
इक टुक तुम्हें देखती हैं
जो बात कहना चाहे ज़ुबां
तुमसे ये वो कहती हैं
आँखों की शर्म-ओ-हया माफ़ हों
उठी आँखें जो बात ना कह सकीं
झुकी आँखें वो कहती हैं
आँखों की गुस्ताखियां ...

काजल का इक तिल तुम्हारे लबों पे लगा लूं
हां चंदा और सूरज की नज़रों से तुमको बचा लूं
ओ पलकों की चिलमन में आओ मैं तुमको छुपा लूं
ख्यालों की ये शोखियां माफ़ हों
हरदम तुम्हें सोचती हैं
जब होश में होता है जहाँ
मदहोश ये करती हैं
आँखों की शर्म-ओ-हया ...

ये ज़िंदगी आपकी ही अमानत रहेगी ऐ हे
दिल में सदा आपकी ही मुहब्बत रहेगी ऐ हे
इन साँसों को आपकी ही ज़रूरत रहेगी
हां इस दिल की नादानियां माफ़ हों
ये मेरी कहां सुनती हैं
ये पल पल जो होती हैं बेकल सनम
तो सपने नए बुनती हैं
आँखों की गुस्ताखियां ...

 ",Hum Dil De Chuke Sanam,1999,Ismail Darbar,Mehboob,"Kumar Sanu, Kavita Subramaniam..."
"हे मिट्टी पे खींची लकीरें रब ने तो ये तस्वीर बनी
आग हवा पानी को मिलाया तो फिर ये तस्वीर सजी
ऐ हस्ती तेरी विशाल हो क़ुदरत का तू कमाल

हे मनमोहिनी तेरी अदा
तुझे जब देख ले तो फिर घटा
बरसे झर झर झर झर झर झर
स र र स र र
नाचे चमक चमक वो बिजली दीवानी
है बेमिसाल तू गोरी गोरी अनछुई
तुझमें है क़ुदरत सारी खोई
तुझमें क़ुदरत सारी खोई खोई
हे आहा हे हे आहा

मिट्टी की है मूरत तेरी मासूमियत फ़ितरत तेरी
ये सादापन ये भोलापन तू महकी महकी तू लहकी लहकी
तू चली चली हर गली गली
तू हवा के ढंग संग सनन सनन
मेरा अंग अंग जैसे जलतरंग
कोई लहर लहर चली ठहर ठहर
पानी का मेल तेरे तन बदन
झर झर र झर र अंगारे जैसा
तेरा रोम रोम है दहका दहका
अग्नि का खेल तू अगन अगन
ज़रा थिरक थिरक ज़रा लचक लचक
कभी मटक मटक कभी ठुमक ठुमक
चली छूम छूम कभी घूम घूम
धरती को चूम मची धूम धूम
चंचल बड़ी तू नटखट बड़ी
तू बहकी बहार रस की फ़ुहार
तेरे तीखे नैन तेरे केश रैन
ये बलखाना ये इतराना
हे आहा हे हे आहा ...

 ",Hum Dil De Chuke Sanam,1999,Ismail Darbar,Mehboob,"Shankar Mahadevan, Chorus"
"आँखों को इंतज़ार का दे के हुनर चला गया
चाहा था एक शख्स को जाने किधर चला गया

दिन की वो महफ़िलें गईं रातों के रतजगे गये
कोई समेट कर मेरे शाम-ओ-सहर चला गया

झोंका है एक बहार का रंग-ए-ख़याल-ए-यार भी
हर-सू बिखर बिखर गई ख़ुश्बू जिधर चला गया

उसके ही दम से दिल में आज धूप भी चाँदनी भी है
दे के वो अपनी याद के शम्स-ओ-क़मर चला गया

कू-ब-कूचा दर-ब-दर कबसे भटक रहा है दिल
हमको भुला के राह वो अपनी डगर चला गया

 ",Asha Aur Khayam (Non-Film),1997,Khayyam,Hasan Kamaal,Asha
"आँखों में रहो बाहों में रहो
होंठों पे रहो या दिल में रहो
ये सारे घर हैं तुम्हारे
जहाँ भी दिल चाहे रहो हाँ

साँसों में रहो धड़कन में रहो
पलकों में रहो ज़ुल्फ़ों में रहो
ये सारे घर हैं ...

पास हमारे आना अब तो बिन बुलाए आ जाना
कोई निशानी दे जाना
थोड़ी सी खुश्बू ले जाना
यादों में रहो ख्वाबों में रहो
रातों में रहो या दिन में रहों
ये सारे घर हैं ...

आज ना जाने ये क्या हुआ है
कोई ज़रा ये समझाए
इतना सुरूर छाया है
जी करता है मर जाएँ
वादों में रहो कसमों में रहो
आँचल में रहो काजल में रहो
ये सारे घर हैं ...

 ",Company,2002,Sandeep Chowtha,Tabish Romani,Saumya Rao
"आँखों में आ जा दिल में समा जा
मेरी कहानी सुन जा अपनी सुना जा -2
आँखों में आ जा दिल में समा जा

बिगड़ी है क़िस्मत जीवन है फीका
जीवन है फीका
आ तुझसे कह दूँ दुख अपने जी का -2
ओ दम भर को आ के मेरी बिगड़ी बना जा

आँखों में आ जा दिल में समा जा
मेरी कहानी सुन जा अपनी सुना जा
आँखों में आ जा दिल में समा जा

इस दिल को दुनिया तड़पा रही है
तड़पा रही है
ऐसे में तेरी याद आ रही है -2
ओ आ और आ के मुझे ग़म से छुड़ा जा

आँखों में आ जा दिल में समा जा
मेरी कहानी सुन जा अपनी सुना जा
आँखों में आ जा दिल में समा जा

छोड़े ना दुनिया दीवाना कर के
दीवाना कर के
जीना भी कोई जीना है मर के -2
ओ हाय मैं कैसे जियूँ ये तो बता जा

आँखों में आ जा दिल में समा जा
मेरी कहानी सुन जा अपनी सुना जा
आँखों में आ जा दिल में समा जा

 ",Dulari,1949,Naushad,Shakeel,Lata
"आँखों में बसा है ख़्वाब जैसा
छलके वो बदन शराब जैसा

आ जाए तो रात खिल उठे है
वो शख़्स है माहताब जैसा

इस नाज़ से वो जफ़ा करे है
पत्थर भी लगे गुलाब जैसा

मिलते हो नज़र नहीं मिलाते
खुल जाओ कभी नक़ाब जैसा

'क़ैसर्' की ग़ज़ल है तेरा चेहरा
पढ़ता हूँ तुझे किताब जैसा

 ",Dilkash (Non-film),2002,Kuldip Singh,Qaisar-ul-Jaffri,Jasvinder Singh
"है ए हो ओ 

आंखों में बसाया था 
(आंखों में बसाया था, तुम्हें दिल में छुपाया था 
आंखों में बसाया था, तुम्हें दिल में छुपाया था 
जब चाहूँ तुम्हें देखूँ, आईना बनाया था) -2 
आंखों में बसाया था, तुम्हें दिल में छुपाया था 

आँखों में अन्धेरा है, वीराना सेहरा है 
ना जाने मेरा वो चांद, किस शहर में उतरा है 
जीने का बता तू ही, अब क्या अरमान करूं 
मर जाने का ऐ दिल, कोई सामान करूं 
इक साथ जियेंगे हम 
(इक साथ जियेंगे हम, क्यों ख्वाब दिखाया था) - 2 
जब चाहूँ देखूँ, आईना बनाया था 

क्या जान सकोगे तुम दिन कैसे गुज़रता है 
इक पल भी नही गुजरे, हां ऐसे गुज़रता है 
ना चैन ही आता है, ना नींद ही आती है 
तेरी याद आती है, आकर तड़पाती है 
मैंने तो तुझे जानम 
मैने तो तुझे जानम पलकों पे बिठाया था - 2 
जब चाहूँ देखूँ, आईना बनाया था 

है ए हो ओ 
आंखों में बसाया था 
(आंखों में बसाया था, तुम्हें दिल में छुपाया था 
आंखों में बसाया था, तुम्हें दिल में छुपाया था 
जब चाहूँ तुम्हें देखूँ, आईना बनाया था ) - 2 

 ",Takkar,1995,Annu Malik,Maya Govind,Kumar Sanu
