Song,Film,YearMusic Director,Lyricist,Singers
"आ, आ जा आ जा ओ जान-ए-वफ़ा
सुन ले तु मेरी सदा
रो रो के मेरी मुहब्बत तुझको पुकारे
ज़रा आ जा आ जा ओ जान-ए-वफ़ा

ना, ना जा ना जा ओ दिलरुबा

तू ही बता तेरे सिवा दुनियाँ में कौन है मेरा
तुझ से सनम हो के जुदा
जी के करूँगी क्या
ना, ना जा ना जा ओ दिलरुबा
आ, आ जा आ जा ओ जान-ए-वफ़ा

कुछ तो सुना दास्ताँ बर्बाद है मेरा जहाँ
फ़रियाद है आसमाँ
दुनियाँ बड़ी बेवफ़ा
ना, ना जा ना जा ओ दिलरुबा
आ, आ जा आ जा ओ जान-ए-वफ़ा




 ",Shirin Farhaad,1956,S Mohinder,Tanvir Naqvi,"Lata, Hemant"
"र : आ आ 
 कैसे समझाऊँ बड़ी नासमझ हो -2
 हमसे न जीतोगी तुम रहने दो ये बाज़ी
 कैसे समझाऊँ ...

आ : आ आ 
 कैसे समझाऊँ बड़े नासमझ हो -2
 आए-गए तुम जैसे सैकड़ों अनाड़ी
 कैसे समझाऊँ ...

र : हम दिल का साज़ बजाते हैं दुनिया के होश उड़ाते हैं
 हम सात सुरों के सागर हैं हर महफ़िल में लहराते हैं -2
 कैसे समझाऊँ ...

आ : तुम साज़ बजाना क्या जानो तुम रंग जमाना क्या जानो -2
 महफ़िल तो हमारे दम से है तुम होश उड़ाना क्या जानो -2
 कैसे समझाऊँ ...

 मैं नाचूँ चाँद-सितारों पर शोलों पर शरारों पर
र : हम ऐसी कला के दीवाने छा जाएँ नशीली बहारों पर
 कैसे समझाऊँ ...

 ",Suraj,1966,Shankar-Jaikishan,Hasrat,"Rafi, Asha"
"र : एक बार आती है रुत ऐसी रोज़ नहीं
 के मुझको सम्भालो कोई मुझको होश नहीं

आ : एक बार आती है रुत ऐसी रोज़ नहीं
 वो दिल कोई दिल नहीं है जिसमें जोश नहीं

र : हो हो हो
 ये तेरी नैन रेखा रेखा में ख़ुद को देखा
 न पूछ दिल की हालत है दौर ये ख़ुशी का -2
 ओ झूम-झूम गाता है दिल ऐसा रोज़ नहीं
 के मुझको सम्भालो ...

आ : हो हो हो
 दिल मेरा डोले ये खाए हिचकोले
 मैं हाय-हाय करूँ ये भेद सारा खोले -2
 हो नैनन बान चलाती है रुत ऐसी रोज़ नहीं
 वो दिल कोई दिल ...

र : हो ये दिल डगमगाए नज़र लड़खड़ाए
 मैं गिर-गिर जाऊँ जब सामने तू आए -2
 हो दिल की बात बताता है दिल ऐसा रोज़ नहीं
 के मुझको सम्भालो ...
को : मुझको होश नहीं

आ : हो प्यार भरी सैंया तू डाल गले बहियाँ
 डाल दूँगी तुझ पर मैं पलकों की छैंया
 हो दिल से दिल मिलाती है रुत ऐसी रोज़ नहीं
 वो दिल कोई दिल ...
को : एक बार आता है दिन ऐसा रोज़ नहीं
 के मुझको सम्भालो कोई मुझको होश नहीं

 ",Suraj,1966,Shankar-Jaikishan,Hasrat,"Rafi, Asha"
"आ आ आ आ आ
आ ऐ आ आ ऐ ऐ आ
अरे अरे
आ तैयार हो जा
आ आ तैयार हो जा
शाम की कश्ती में आ के सवार हो जा चलो चलें
आ सहारा होगा
कहीं ना कहीं तो कोई किनारा होगा चलो चलें
अररररररर
आ आ आ आ तैयार हो जा ...

आ तैयार हो जा रे
आजा आजा चल चलें
तैर के या डूब के चल पार जाना है
शाम की कश्ती ...

शाम कुंवारी होगी
होंठ हमारे होंगे बात तुम्हारी होगी
बात तो भोली होगी
मीठी भी होगी थोड़ी शहद भी घोली होगी
आ आ आ आ आ
शाम कुंवारी ...

प्यार का गोता क्या है
डूब के देखा नहीं देखना होता क्या है
होने को होना क्या है
दिल में टीस होगी आँख में पानी होगा चलो चलें
आ आ आ आ आ
प्यार का गोता ...

 ",Asoka,2002,Annu Malik,Gulzar,"Sunidhi Chauhan, Chorus"
"आ आजा दिखाऊँ तुझे जन्नत की शाम
ज़ुल्फ़ों की छैंया में कर ले आराम
आ आजा ...

जो रंग मेरे बदन में है वो गुलों में कहाँ
महक उठी है ये महफ़िल अजब गुलाब हूँ मैं
मेरी अदा मेरी पायल ये गीत मस्ताने
मेरा जवाब नहीं हाय लाजवाब हूँ मैं
आँखें मिला के पी ले आँखों के जाम
आ आजा ...

जहाँ में आये हो कुछ रोज़ ऐश कर जाओ
न जाने कल ये ज़माना रहे रहे न रहे
ये ज़िंदगी है बड़ी बेवफ़ा तुम्हारी क़सम
न जाने कल ये तराना रहे रहे न रहे
देखा जायेगा जो होगा अंजाम
आ आजा ...


 ",Laal Pathhar,1971,Shankar-Jaikishan,Hasrat,Asha
"मु : आ अब लौट चलें -2
 नैन बिछाए बाँहें पसारे तुझको पुकारे देश तेरा
ल : आ जा रे -2
को : आ आ आ

मु : सहज है सीधी राह पे चलना
 देख के उलझन बच के निकलना
 कोई ये चाहे माने न माने
 बहुत है मुश्किल गिर के संभलना
 आ अब लौट चलें ...

 आँख हमारी मंज़िल पर है
 दिल में ख़ुशी की मस्त लहर है
 लाख लुभाएँ महल पराए
 अपना घर फिर अपना घर है
 आ अब लौट चलें ...

 ",Jis Desh Mein Gangaa Behti Hai,1960,Shankar-Jaikishan,Shailendra,"Mukesh, Lata"
" 

आ भी जा मेरी दुनिया में कोई नहीं
बिन तेरे कब तलक यूँ ही घबराये दिल -2

आ मिले तेरी नज़रों से ऐसे नज़र
कुछ न अपनी ख़बर हो न तेरी ख़बर
लाख ढूँढूं मगर फिर न पाऊँ कहीं
यूँ मुहब्बत के तूफ़ाँ में बह जाये दिल

तेरी साँसों की खुशबू में खो जाऊँ मैं
छाँव में तेरी पलकों की सो जाऊँ मैं
तू ही तो मेरे ख़्वाबों की है नाज़नीं
क्यों न तेरे लिये झूम कर गाये दिल

चाँदनी की तरह मेरी महफ़िल में आ
कोई आहट न हो इस तरह दिल में आ
आस्माँ है जो दुश्मन तो ज़ालिम ज़मीं
हो न ऐसा के कहना पड़े हाय दिल

आ भी जा मेरी दुनिया में कोई नहीं
बिन तेरे कब तलक यूँ ही घबराये दिल

 
 ",Daera,1953,Jamal Sen,Majrooh,Talat
"ल : ( आ भी जा आ भी जा ऐ सुबह आ भी जा -2
 रात को कर विदा दिलरुबा आ भी जा ) -2
 आ भी जा आ भी जा ऐ सुबह आ भी जा
 
 मेरे मेरे दिल के पागलपन की ओ सीमा क्या है
 यूँ तो तू है मेरी छाया तुझमें ओ तेरा क्या है
 मैं हूँ गगन तू है ज़मीं अधूरी सी मेरे बिना
 रात को कर विदा दिलरुबा आ भी जा
 आ भी जा आ भी जा ऐ सुबह आ भी जा -2
 
सु : देखूँ चाहे जिसको कुछ-कुछ तुझसा दिखता क्यूँ है
 जानूँ जानूँ ना मैं तेरा-मेरा रिश्ता क्यूँ है
 कैसे कहूँ कितना बेचैन है दिल मेरा तेरे बिना
 रात को कर विदा दिलरुबा आ भी जा
 आ भी जा आ भी जा ऐ सुबह आ भी जा -2

 ",Sur,2002,M M Kreem,Nida Fazli,"Lucky Ali, Sunidhi Chauhan"
"( दिल में जागी धड़कन ऐसे पहला-पहला पानी जैसे
ऐसा छाया मुझपे जादू हा-हा ही-ही हे-हे हू-हू
भूली मैं सब आना-जाना गाना-वाना खोना-पाना
किसकी निगाहों से ) -2
बदली ज़मीं आसमाँ ये जहाँ
मुझमें नाचे-गाए घूमे-झूमे
दिल में जागी धड़कन ऐसे ... किसकी निगाहों से

कोई सपना छुप-छुप के साँसों में मेरी छलता है
कोई अपना
कोई अपना दीपक सा राहों में मेरी जलता है
देखूँ सपना
थोड़ी मैं सोऊँ थोड़ी मैं जागूँ
जागूँ ना सोऊँ लगता है सारा उल्टा-पुल्टा
दिल में जागी धड़कन ऐसे ... किसकी निगाहों से

बातें दिल की अन्जाने होंठों से कोई पढ़ता है
बातें दिल की
सीधा सब कुछ देखूँ तो नज़रों को टेढ़ा लगता है
सीधा सब कुछ
चन्दा धरती पर धरती अम्बर में
अम्बर पैरों में लगता है सारा उल्टा-पुल्टा
दिल में जागी धड़कन ऐसे ... किसकी निगाहों से
बदली ज़मीं आसमाँ ये जहाँ
मुझमें नाचे-गाए घूमे-झूमे
ला ला ला ला
किसकी निगाहों से

 ",Sur,2002,M M Kreem,Nida Fazli,Sunidhi Chauhan
"आ चल के तुझे, मैं ले के चलूं
इक ऐसे गगन के तले
जहाँ ग़म भी न हो, आँसू भी न हो
बस प्यार ही प्यार पले
इक ऐसे गगन के तले

सूरज की पहली किरण से, आशा का सवेरा जागे  (2)
चंदा की किरण से धुल कर, घनघोर अंधेरा भागे  (2) 
कभी धूप खिले कभी छाँव मिले
लम्बी सी डगर न खले
जहाँ ग़म भी नो हो,  आँसू भी न हो ...

जहाँ दूर नज़र दौड़ आए, आज़ाद गगन लहराए
जहाँ रंग बिरंगे पंछी, आशा का संदेसा लाएं   (2)
सपनो मे पली हँसती हो कली
जहाँ शाम सुहानी ढले
जहाँ ग़म भी न हो,  आँसू भी न हो ...
आ चल के तुझे मैं ले के चलूं ...

सपनों के ऐसे जहाँ में जहाँ प्यार ही प्यार खिला हो
हम जाके वहाँ खो जाएँ शिकवा ना कोई गिला हो
कोई बैर न हो, कोई ग़ैर न हो
सब मिलके यूँ चलते चलें
जहाँ ग़म भी न हो,  आँसू भी न हो ...
आ चल के तुझे मैं ले के चलूं ...


 ",Door Gagan Ki Chhaon Mein,1964,Kishore,Kishore,Kishore
"ल : आ आ आ आ -2
 चली रे चली रे गोरी पनिया भरन को -2
 पनिया भरन को -2
कि : पनिया भरन को के मिलने सजन को -2
ल : चली रे चली रे ...

 सैंया से मिलने जो जाती गुजरिया -2
 साथ भला काहे लाती गगरिया
कि : हो हो हो ओ ओ ओ
 साथ अगर तू न लाती गगरिया
 तो शक़ करती तुझपे सारी नगरिया
 राधा गई थी कहाँ
 राधा गई थी यूँ ही मिलने किसन को
ल : चली रे चली रे ...

कि : जाने दे गोरी छोड़ बहाना
 अब तो मुश्किल है बात छुपाना
 देखा है तेरे मुखड़े पे प्रीत का मैने रंग सुहाना
ल : तू न मानेगा मैने माना
 बात में झूमें आज ज़माना
 बोले देखी है प्रीत मैने बावरा है तू है दीवाना
कि : हाँ क्या किसने कभी देखा है पवन को -2
 चली रे चली रे ...

ल : माने अगर तू ना मेरी बतियों से -2
 पूछ ले चाहे तो मेरी सखियों से
कि : हो हो हो हो ओ ओ
 काम चलेगा ना इन बतियों से
 के साफ़ है ज़ाहिर तेरी अंखियों से
 किसी ने चुराया क्या
 किसी ने चुराया हुआ है तेरे मन को
ल : चली रे चली रे ...

 ",Mr. X in Bombay,1964,Laxmikant-Pyarelal,Anand Bakshi,"Kishore, Lata"
"( आ दिल से दिल मिला ले ) -2 इस दिल में घर बसा ले
ओ रसिया मन-बसिया आजा गले लगा ले
आ दिल से दिल ...

दिल के चमन में कब से बुलबुल चहक रही है -2
फूलों के इस बदन में ख़ुश्बू महक रही है -2
कंगना में मेरे लाखों अरमाँ चमक रहे हैं -2
( अँगना में तेरे साजन ) -2 घुँघरू झनक रहे हैं
आ दिल से दिल ...

चमकेंगे लाख चन्दा ये रात फिर ना आए -2
होंगी हज़ार बातें ये बात फिर ना आए -2
साजन यूँ संग तन के मन साथ फिर ना आए -2
( नवरंग सा रंगीला ) -2 प्रभात फिर ना आए
आ दिल से दिल ...

 ",Navrang,1959,C Ramchandra,Bharat Vyas,Asha
"आ गए दिल में तुम मेरी महफ़िल में तुम
बच के नज़रों से मेरी कहाँ जाओगे
आए मिलने के दिन फूल खिलने के दिन
हम पुकारेंगे और तुम चले आओगे

तेरी ख़ातिर यहाँ मुझको आना पड़ा
गीत गाया हुआ फिर से गाना पड़ा
देख ले है मुहब्बत में इतना असर
मिल गई फिर हमारी तुम्हारी नज़र
ज़िन्दगी है जवाँ अब जुदाई कहाँ
जिस जगह जाओगे तुम हमें पाओगे
आ गए दिल में तुम ...

 ",Naazneen,1951,Ghulam Mohammad,Shakeel,Lata
"आ गए दिन सनम इकरार के
कभी कहीं न हम रुकेंगे हार के
आ गए दिन सनम ...

ओ मनमीत होगी प्यार की जीत
है रब भी साथ उनके जो करते हैं प्रीत
होगी प्यार की जीत
है रब भी ...

कुछ भी ज़माना करे हम ना किसी से डरें
हम चल पड़े आसमां को झुकाएं
दिल के लहू से लिखेंगे फ़साने
आ गए दिन सनम इज़हार के
कभी कहीं न ...

ले के नए ज़लज़ले तूफ़ान बन के चले
गाते रहेंगे मिलन के तराने
होंगे जुदा ना कभी हम दीवाने
आ गए दिन सनम दीदार के
कभी कहीं न ...

 ",Hogi Pyaar Ki Jeet,1999,Anand-Milind,Sameer,"Abhijit, Sonu Nigam, Jaspindar..."
"आ गई अरे छप्पन छुरी छम छम छम करैइ आ गई
हाँ तो क्या करेगी
अरे गाएगी नाचेगी झूमेगी और सबका दिल बहलाएगी
हाँ तो भाई जान मेहरबान क़दरदान कुछ क़दर कीजिए
याने सिर्फ़ एक रुपया दीजिए मेरे भैया एक रुपया
एक रुपया एक रुपया दोगे दो दो काम करूँगी
ओ पहले गाना गाऊँगी फिर सलाम करूँगी
एक रुपया दोगे ...

ज़रा चढ़ती जवानी के नज़ारे देखना
अरे जलवे ये जलवे कंवारे देखना
मैं तो अँखियों में भर दूँगी मीठे सपने
जो कुछ हैं तुम्हारे कुछ मेरे अपने
अरे जो भी करूंगी हाँ हाँ जो भी करूँगी खुले आम करूँगी
एक रुपया दोगे ...

मेरे गालों पे ज़ुल्फ़ जो मचल जाएगी
अरे कईयों की नीयत बदल जाएगी
मेरी पतली कमर में तो लोच आएगी
दीवाने दिलों को ये तड़पाएगी
हो मैं तो रातों की निंदिया हराम करूँगी
एक रुपया दोगे ...

 ",Sherani,1988,Kalyanji-Anandji,Verma Malik,Anuradha Paudwal
"(आ गई बहार, आ गई
मन की कली मुसकाई
नस नस में जागा प्यार, जागा प्यार)-2

आँखों ने क्या, मन से कहा
अंग अंग झूम रहा
होने लगा है खुमार, जागा प्यार
मन की कली मुसकाई
नस नस में जागा प्यार

विरहा के दिन बीत गये
गाले गाले गीत नये
बजने लगे हैं तार, जागा प्यार
आ गई बहार, आ गई
मन की कली मुसकाई
नस नस में जागा प्यार, जागा प्यार

आँखों ने क्या, मन से कहा
अंग अंग झूम रहा
चाने लगा है खुमार, जागा प्यार
मन की कली मुसकाई
नस नस में जागा प्यार

 ",Nai Taleem,1949,Vasant Desai,S R Chopda,Lata
"आ गई याद शाम ढलते ही
बुझ गया दिल चराग़ जलते ही

खुल गये सहर-ए-ग़म के दरवाज़े
इक ज़रा सी हवा के चलते ही

कौन था तू के फिर न देखा तुझे
मिट गया ख़ाब आँख मलते ही

तू भी जैसे बदल सा जाता है
अक्स-ए-दीवार के बदलते ही

 ",Anjuman (Non-Film),1990,nan,Munir Niyazi,Ghulam Ali
"आ गले लग जा मेरे सपने मेरे अपने मेरे पास आ -2

आबाद है तू मेरी धड़कनों में मेरी जान तुझमें बसी है
बादल से जो आस है मोर को मेरे दिल को वो तुझसे लगी है
इक तेरी मुस्कान अंगड़ाई लेती हुई मेरी तक़दीर जागे
इक तेरी झलक चली आए पल में मेरी मंज़िलें मेरे आगे
आ गले लग जा ...

मन आज़माँ तू मेरे प्यार को खेल मत यूँ मेरी ज़िन्दगी से
उल्फ़त के मारों को क्या मारना जान दे देते हैं जो ख़ुशी से
ये हुस्न जिसको मिले जान-ए-जाँ बेदिली उसकी जँचती नहीं है
हो रू-ब-रू चाँद से जो हसीँ बेरुख़ी उसको सजती नहीं है
आ गले लग जा ...

 ",April Fool,1964,Shankar-Jaikishan,Shailendra,Rafi
"हो आ गया हे आ गया हाँ आ गया आ गया
Hey you beautiful girls
I have this beautiful flower in my hands
I wonder which one of you will be lucky to get it
you, you, you, how about you

आ गया आ गया दिल चुराने मैं आ गया
आ गया आ गया दिल चुराने ये आ गया
Life is love-able pyaar nahii.n sell-able
दिल मेरा available तेरे लिए
आ गया ...

नया गीत है नया साज़ है नई beat है हा नया राग है
मेरे साथ में ज़रा झूम ले मिला के नज़र आ मुझे चूम ले
रंग जमाने आया आया
धूम मचाने आया आया
चैन चुराने आया आया
प्यार का तोहफ़ा लाया लाया
आ गया ...

जवाँ उम्र है हा हसीं रात है चाहतों भरी मुलाकात है
जिस को देखिए बेकरार है हर हसीन को मुझ से प्यार है
होश उड़ाने आया आया
ख़्वाब सजाने आया आया
गम भुलाने आया आया
महफ़िलों पे छाया छाया
आ गया ...

 ",Hum Tumhare Hain Sanam,2002,Nikhil-Vinay,Sameer,"Udit Narayan, Chorus"
