Song,Film,YearMusic Director,Lyricist,Singers
"शंकर:
  मैंने जिसे अभी अभी देखा है ... कौन है वो अनजानी
  उसे जितना देखूँ ... उतना सोचूँ ... क्या उसे मैं कह दूँ

शंकर:
  HIT IT!
  मैंने जिसे अभी अभी देखा है ... (Dhol)
  कौन है वो अनजानी ... (Dhol)
  मैंने जिसे अभी अभी देखा है, कौन है वो अनजानी क्ष 2
  वो है कोई कली या कोई किरन या है कोई कहानी
  उसे जितना देखूँ उतना सोचूँ क्या उसे मैं कह दूँ
  Pretty Woman हे ...

कोरस:
  Pretty Woman dekho dekho naa Pretty Woman
  Pretty Woman dekhate ho naa Pretty Woman
  Pretty Woman tum bhii kaho naa Pretty Woman

शंकर:
  हो ... मैंने जिसे अभी अभी देखा है, कौन है वो अनजानी 
  वो है कोई कली या कोई किरन या है कोई कहानी
  उसे जितना देखूँ उतना सोचूँ क्या उसे मैं कह दूँ
कोरस:
  Pretty Woman dekho dekho naa Pretty Woman
  Pretty Woman dekhate ho naa Pretty Woman
  Pretty Woman tum bhii kaho naa, o Pretty Woman


(ड़ाP)
  Yओ! Pरेत्त्य वोमन्!
  ळिस्तेन उप गिर्ल, व्ह्य [दो] योउ फ़ेएल थिस वय
  डोन्'त योउ सी थे सुन्शिने cओमिन्' ओउत तोदय
  Yओउ गोत्त फ़ेएल इत लिघ्त, जुस्त लिके दय अफ़्तेर निघ्त
  डोन्'त लेत थे सुन्शिने ओउत ओफ़ योउर सिघ्त
  'चोज़ - ई - चन - Fईल - Yओउ.  Yओउ, cअन योउ फ़ेएल मे
  Wहेन ई सय थत.
  ई - चन - Fईल - Yओउ.  Yओउ, cअन योउ फ़ेएल मे हेरे
  Wहेन ई सय थत.
  ई'म cराआअज़्य 'बोउत योउ, प्रेत्त्य वोमन्!

शंकर:
  सोने का रंग है, शीशे का अंग है,
  जो देखे दंग है, क्या कहूँ,
  हैरान मैं भी हूँ
  ये क्या अंदाज़ है, इतना क्यूँ नाज़ है,
  इसमें क्या राज़ है, क्या कहूँ
  ओ ... वो तो पल में ख़ुश है, पल में ख़फ़ा
  बदले वो रंग हर घड़ी
  पर जो भी देखूँ रूप उसका
  लगती है प्यारी बड़ी
  उसे जितना देखूँ उतना सोचूँ क्या उसे मैं कह दूँ
  Pretty Woman ...
कोरस:
  Pretty Woman dekho dekho naa Pretty Woman
  Pretty Woman dekhate ho naa Pretty Woman
  Pretty Woman tum bhii kaho naa Pretty Woman

कोरस:
  अड़िप्पा!  ओ ओ ओ ओ ओ क्ष 2
  अड़िप्पा!  ओ ओ ओ ओ ओ क्ष 2
Rap guy: oy chak de phaTTe!
शंकर:
  ओ ... आँखों में है नशा, ज़ुल्फ़ों में है घटा
  पहले हमने अदा ये हसीं, देखी न थी कहीं
  देखी जो ये परी, मस्ती दिल में भरी
  है ये जादूगरी या नहीं
  हो ... न तो जानूँ क्या है नाम न जानूँ मैं पता
  पर इतना है मैंने जाना
  जिसे देख ले एक नज़र भर के
  उसको कर दे वो दिवाना
  उसे जितना देखूँ उतना सोचूँ क्या उसे मैं कह दूँ
  ... -  ... (4 empty counts)
कोरस:
  Pretty Woman dekho dekho naa Pretty Woman
  Pretty Woman dekhate ho naa Pretty Woman
  Pretty Woman tum bhii kaho naa Pretty Woman
कोरस:
  Pretty Woman dekho dekho naa Pretty Woman
  Pretty Woman dekhate ho naa Pretty Woman
  Pretty Woman tum bhii kaho naa Pretty Woman

 ",Kal Ho Na Ho,2003,Shankar-Ehsaan-Loy,Javed Akhtar,"Shankar Mahadevan, Chorus"
"वंदे मातरम

सुजलाम सुफलाम मलयज शीतलाम

शस्य श्यामलाम मातरम

वंदे मातरम 

शुभ्र ज्योत्सना पुलकित यामिनी

फुल्ल कुसुमित द्रुमदल शोभिनी

सुहासिनी सुमधुर भाषिनी

सुखदाम वरदाम मातरम


वंदे मातरम

शस्य श्यामलाम मातरम

वंदे मातरम 

शुभ्र ज्योत्सना पुलकित यामिनी

सुहासिनी सुमधुर भाषिनी

सुखदाम वरदाम मातरम

 ",Vande Mataram (Non-Film),1996,A R Rahman,Bankim Chandra Chatterjee,"A R Rahman, Chorus"
"road के हर मोड़ पे देखो तो गौर से
कातिल रास्ते मिलते हैं चारों ओर से
इक पल में क्याअ हो जाए सब हैं बेखबर
ज़िंदगी और मौत भी चलती है road पर
road के हर मोड़ पे ...

लम्बी लम्बी रात है मीलों तन्हाई
जहाँ खत्म हो रास्ता वो सुबह ना आई
थम गए तो मील के पत्थर road पर
चल दिये तो आसमां झुकता है road पर
road के हर मोड़ पे ...

कुछ खोया कुछ पाया फिर पा के खो दिया
जो कुछ भी होना था इक पल में हो गया
धूल की बारिशें ये गरम हवाएँ
आवारा पागल दीवाने सब हैं road पे
road के हर मोड़ पे ...

 ",Road,2002,Sandesh Shandilya,Tabish Romani,"Garry Lawyer, Tanisha"
"र : rock rock rock rock baby rock
 दो एकम दो दो दूनी चार
 थोड़ा-थोड़ा दे-दे मेरे दिल को क़रार
 दो एकम दो दो दूनी चार दो एकम दो

आ : दो तिया छ्ः दो चौके आठ
र : देना-देना-देना मेरे हाथों में हाथ -2
आ : दो पंजे दस दो छक्के बारा
र : शादी न हुई तो कोई रोयेगा बेचारा -2
आ : दो एकम दो अरे दो दूनी चार ...

 दो सत्ते चौदह दो अट्ठे सोलह
र : दाढ़ी को जलाए तेरे प्यार का शोला -2
आ : तो नमा अठारह दो दहम बीस
र : हो गया गाना अब लाओ मेरी फ़ीस -2
आ : दो एकम दो
र : ओय दो दूनी चार
आ : थोड़ा-थोड़ा
र : दे-दे मेरे दिल को क़रार
 दो एकम दो
आ : अरे दो दूनी चार
र : थोड़ा-थोड़ा
आ : दे-दे मेरे दिल को क़रार
दो : दो एकम दो

 ",Dil Deke Dekho,1959,Usha Khanna,Majrooh,"Rafi, Asha"
"कौन हो तुम कौन हो तुम कौन कौन कौन कौन कौन कौन
romeo नाम मेरा चोरी है काम मेरा
क्या क्या क्या
मैं दिल को चुराऊं मैं प्यार चुराऊं
मैं नींदे चुराऊं मैं चैन चुराऊं
मैं चोरी चोरी पहले नैन मिलाऊं
जो नैन मिले तो मैं नैन चुराऊं
romeo नाम मेरा ...

कोई न जाने मेरा फ़साना
लोग ये समझे मैं कोई दीवाना
जो रातों में घूमे जो बिन पिए झूमे
जो तारे गिने जो कली को चूमे
ये कोई न जाने मुझ सा दीवाना
पलट दे दुनिया बदल दे ज़माना
romeo नाम मेरा ...

खतरों से खेला हूँ मैं
खतरों में पला हूँ मैं
जान हथेली पे लिए घूम रहा हूँ मैं
जो थमता नहीं है जो रुकता नहीं है
वो आवारा हूँ मैं वो बंजारा हूं मैं
कभी मैं यहां हूँ कभी मैं वहां हूँ
कभी ज़मीं हूँ कभी आसमां हूँ
romeo नाम मेरा ...

 ",Roop Ki Raani Choron Kaa Raajaa,1993,Laxmikant-Pyarelal,Javed Akhtar,Amit Kumar
"ओ ले ले ओल्ले ओल्ले ओल्ले ओल्ले ले ले ले 
ओ ले ले ओल्ले ओल्ले ओल्ले ले ले ओल्ले ले ले ले 

Romeo तेरी क़िस्मत हँसते-गाते खुल जाये

Juliet जैसी प्यारी एक हसीना मिल जाये 

ओल्ले लो ओ ओल्ले ओल्ले ले ले 
दिल के फूल खिल जायें

प्यार के दिवाने की एक तमन्ना है

मिल जाये प्यारी-प्यारीइ दिलरुबा

Romeo तेरी क़िस्मत हँसते-गाते खुल जाये
Juliet जैसी प्यारी एक हसीना मिल जाये
दिल के फूल खिल जायें -2

जलवे जलवे जलवे जलवे

जलवे हैं क़ुदरत के नखरे हैं उल्फ़त के

रूप हैं क़ुदरत के नखरे हैं उल्फ़त के

रूप है ऐसा चाँद के जैसा रान्ग है ऐसा चाँदनी जैसा

इक दिन देखा तो उड़ गये होश मेरे

बार-बार देखा तो कैसे होंगे हाल मेरे

ओ ओ ओ ओ ओ ओ ओ ओ ओ ओ 
हय कहाँ से इसको जीवन मिला है ये अंग-अंग में कौन सी कला 

मुस्कराये तो फूल खिलते हैं इक रूप की रानी मिल गई मुझे

ओ ले ले ओल्ले ओल्ले ओल्ले ओल्ले ले ले ले 
ओ ले ले ओल्ले ओल्ले ओल्ले ले ले ओल्ले ले ले ले 
Romeo तेरी क़िस्मत हँसते-गाते खुल जाये
Juliet जैसी प्यारी एक हसीना मिल जाये
दिल के फूल खिल जायें -2

प प प प प प प प प प प प 
हुर्र्र प प प 
ओ ले ले ले ओल्ले ले ले 
ओ ले ले रे ओल्ले ले ले 
चाँदी सी चमक तेरी चंदन सी महक तेरी

दो घड़ी हमसे जान-ए-जाँ मेरी प्यार कर ले तू तमन्ना मेरी

तुझपे दिवानी हो के झूमे नाचे सारी बस्ती

जानती है सारी दुनिया प्यार में है मस्ती-मस्ती

ओ ओ ओ ओ ओ ओ ओ 
ओ ओ ओ ओ ओ ओ ओ 
तुझपे आ गया दिल मेरा क्या कसूर

मेरी दिलरुबा कभी होना नहीं दूर

ज़िंदगी मेरी हो गई तेरी

मेरी जाँ कभी डरना नहीं प्यार यूँ ही पलता रहे

( Romeo तेरी क़िस्मत हँसते-गाते खुल जाये
Juliet जैसी प्यारी एक हसीना मिल जाये ) -2
दिल के फूल खिल जायें
प्यार के दिवाने की एक तमन्ना है
मिल जाये प्यारी-प्यारीइ दिलरुबा

Romeo तेरी क़िस्मत हँसते-गाते खुल जाये
Juliet जैसी प्यारी एक हसीना मिल जाये
दिल के फूल खिल जायें -2

 ",Mr Romeo,1996,A R Rahman,P K Mishra,"Hariharan, Chorus"
"मु : ruby o ruby जान-ए-महबूबी
 दिल की बातें छेड़ दे
ल : अब न कर इंतज़ार क्यूँ कि हम-तुम में प्यार
 होने वाला है आजकल में
दो : ruby o ruby ...

मु : दिल को बनाएँ साज़ आज की रात हम
ल : दिल के उठाएँ नाज़ आज की रात हम
मु : कहने दो
ल : जो न कहा
मु : सुन ले वो
ल : जो न सुना
दो : ये उमर ना गुज़र जाए आजकल में
 ruby o ruby ...

मु : नज़रें चुरा के हम क्या करेंगे सनम
ल : दामन बचा के हम क्या करेंगे सनम
मु : फिर कभी
ल : होना तो है
मु : ये सितम
ल : होना तो है
दो : होना है तो हो जाए आजकल में
 ruby o ruby ...

 ",Chaahat,1971,Laxmikant-Pyarelal,Anand Bakshi,"Mukesh, Lata"
"हाँ जी बादशाहों
की देख रए हो तुसी
चलो शुरू हो जाओ
ओये one two one two three four

say शावा शावा
रूप है तेरा सोणा सोणा सोणी तेरी पायल पायल
हे रूप है तेरा सोणा सोणा सोणी तेरी पायल पायल
छन छना छन ऐसे छनके कर दे सब को घायल
कह रहा आँखों का काजल इश्क़ में जीना मरना
ये say शावा शावा माहिया
Say शावा शावा ये

रूप है मेरा सोणा सोणा सोणी मेरी पायल पायल
छन छना छन ...
Everybody
say शावा शावा माहिया

माहिया वे आजा माही माहिया वे आजा
शावा शावा Say शावा शावा हूँ हूँ

आजा गोरी नच ले हाय शावा
नच ले वे नच ले हाय शावा
अरे आजा गोरी नच ले हाय शावा
हे नच ले वे नच ले हाय शावा

देखा तैनूं पहली पहली बार वे
होने लगा दिल बेकरार वे
रब्बा मैनूं की हो गया दिल जाणिये
हाय मैनूं की हो गया
सुन के तेरी बातें सोणे यार वे
माही मैनूं तेरे नाल प्यार वे
हाय मैं मर जावाँ दिल जाणिये
हाय मैं मर जावाँ 
वे शावा शावा भांगड़ा वे शावा शावा
ओ बल्ले बल्ले ओ बल्ले बल्ले ओ बल्ले बल्ले ओ बल्ले बल्ले
होय होय होय होय

ए ले
हाय शावा हाय शावा

इन कदमों में साँसे वार दें
रब से ज्यादा तुझे प्यार दें
रब्ब मैनूं माफ़ करीं रब्बा खैरिया
हाय मैनूं माफ़ करे

तुम तो मेरी ज़िंद मेरी जान वे
मेरी तू ज़मीं है आसमान वे
तुझ बिन मैं की कराँ रब्बा खैरिया
हाय वे मैं की कराँ
say शावा शावा माहिया
say shaavaa shaavaa say

हे रूप है तेरा सोणा...
Come on
say shaavaa shaavaa maahiyaa Say शावा शावा माहिया
say shaavaa shaavaa bhaa.nga.Daa Say भांगड़ा

 ",Kabhi Khushi Kabhi Gham,2002,Aadesh Srivastava,Sameer,"Alka Yagnik, Sunidhi Chauhan, ..."
"sir bhii ruuThe ruuThe hai.n teacher भी रूठी रूठी हैं
piknik में नहीं कोई शोर हम तो हो गए बोर

आपने सिखाया हमें हँसा करो हरदम हरदम
खुश रहो प्यार करो गुस्सा करो कम कम
खुद फिर तो हँसो ना गुस्सा कम करो ना
हम जो रूठ गए तो नहीं चलेगा कोई ज़ोर
piknik में नहीं कोई ...

मैं नहीं रूठी तुमसे बच्चों किसी ने मुझे सताया
किसने वही जो साथ हमारे piknik में आया
sir अंदर से जैसे भी ऊपर से सच्चे लगते हैं
गुस्से में teacher तुम्हारी और भी अच्छी लगती है

झांझरिया उसकी खनक गई
चुनरी भी सर से सरक गई
मेरी नज़र उससे मिली तो उसकी नज़र शरमा के झुक गई
झांझरिया

किताबें बहुत सी पढ़ी होंगी तुमने
मगर कोई चेहरा भी तुमने पढ़ा है
पढ़ा है मेरी जां नज़र से पढ़ा है
बता मेरे चेहरे पे क्या क्या लिखा है

 ",Aakrosh/ A Cyclone of Anger,1998,Anand Raj Anand,Faiz Anwar,"Kavita Subramaniam, Chorus"
"यूँ मिलाके नज़र, कर के जादूगरी
देके दर्द-ए-जिगर, आगे पीछे डोल कर
Soldier Soldier मीठी बातें बोल कर
दिल तू चुरा ले गया   ...

यूँ मिलाके नज़र, कर के जादूगरी
देके दर्द-ए-जिगर, आगे पीछे डोल कर
Soldier Soldier मीठी बातें बोल कर
दिल तेरा उड़ा ले गया   ...

न न न मेरी हाँ बन गयी
तू तू तू मेरी जाँ बन गयी
अजि क्यों क्यों क्यों मुझे प्यार हो गया
यूँ यूँ यूँ इक़रार हो गया
क़सम से तू बड़ा झूठा
हो सनम तूने मुझे लूटा
यूँ मिलाके नज़र   ...

आ आ आ मेरे पास तो ज़रा
जा जा जा कोई प्यास न जगा
क्या क्या क्या कोई दर्द उठा क्या
हाँ हाँ हाँ मेरा हाल है बुरा
तुझे आये कोई जादू
मेरा मुझपे नहीं क़ाबू
यूँ मिलाके नज़र   ...


 ",Soldier,1998,Annu Malik,Sameer,"Kumar Sanu, Alka Yagnik"
"ईन थे वोर्ल्द्'स ब्रोअद फ़िएल्द ओफ़ बत्त्ले,
ईन थे बिवोउअc ओफ़ ळिफ़े,
Bए नोत दुम्ब, द्रिवेन cअत्त्ले!
Bए अ हेरो इन थे स्त्रिफ़े!

ळेत उस, थेन, बे उप अन्द दोइन्ग,
Wइथ अ हेअर्त फ़ोर अन्य फ़ते;
Sतिल्ल अचिएविन्ग, स्तिल्ल पुर्सुइन्ग,
ळेअर्न तो लबोर अन्द तो वैत.

णोत एन्जोय्मेन्त, अन्द नोत सोर्रोव,
ईस ओउर देस्तिनेद एन्द ओर वय्;
Bउत तो अcत, थत एअच तोमोर्रोव
Fइन्द उस फ़र्थेर थन तोदय.

ळेत उस, थेन, बे उप अन्द दोइन्ग् ...

ळिवेस ओफ़ ग्रेअत मेन अल्ल रेमिन्द उस
Wए cअन मके ओउर लिवेस सुब्लिमे,
आन्द, देपर्तिन्ग, लेअवे बेहिन्द उस
Fऊत्प्रिन्त्स ओन थे सन्द्स ओफ़ तिमे;

Fऊत्प्रिन्त्स, थत पेर्हप्स अनोथेर,
Sऐलिन्ग ओ'एर लिफ़े'स सोलेम्न मैन,
आ फ़ोर्लोर्न अन्द शिप्व्रेcकेद ब्रोथेर,
Sईइन्ग, शल्ल तके हेअर्त अगैन

ळेत उस, थेन, बे उप अन्द दोइन्ग् ...

 ",Duniya Na Maane/ The Unexpected,1937,Keshavrao Bhole,H W Longfellow,Shanta Apte
"sorry baabaa sorry मुझको माफ़ कर दो ना
फिर ना गलती होगी अब दिल साफ़ कर दो ना
मैं क्या करूं हो गया late मैं 
कुछ काम से जाना था
रस्ते में Traffic Jam था
मुश्किल बड़ा आना जाना था
sorry बाबा ...

ऐसे दिल को तोड़ो ना जानूं जाने भी दो
बाहें मेरी छोड़ो ना नज़दीक आने भी दो
जा झूठे तेरी बातें ना मानूं रे
come on
तू क्या है कैसा है पहचानूं रे
ना ना
sorry बाबा ...

झूठा वादा तेरा है ना था मुझको पता
सच्चा गुस्सा मेरा है तूने की है खता
कुछ उल्टा सीधा मैं कर जाऊँगा
अच्छा
ना मानोगी तुम तो मर जाऊंगा
मर जा
sorry बाबा ...

अरे अरे रुको रुको क्या कर रहे हो
ठीक है बाबा ठीक है
अच्छा बाबा अच्छा मैने माफ़ कर दिया

 ",Jungle,2000,Sandeep Chowtha,Sameer,"Sonu Nigam, Sadhana Sargam"
