Song,SongTitleEnglish,SongTitleHindi,Year,MovieEnglish,MovieHindi,Music Director,Lyricist,SingersEnglish,SingersHindi
"चैन से हमको कभी आपने जीने ना दिया
ज़हर भी चाहा अगर, पीना, तो पीने ना दिया
चैन से हमको कभी

चांद के रथ में रात की दुल्हन जब-जब आएगी
याद हमारी आपके दिल को तड़पा जाएगी
आपने जो है दिया, वो तो किसी ने ना दिया
ज़हर भी चाहा अगर, पीना, तो पीने ना दिया
चैन से हमको कभी...

आपका ग़म जो इस दिल में, दिन-रात अगर होगा
सोच के ये दम घुटता है, फिर कैसे गुज़र होगा
काश ना आती अपनी जुदाई, मौत ही आ जाती
कोई बहाने चैन हमारी, रूह तो पा जाती
इक पल हँसना कभी, दिल की लगी ने ना दिया
ज़हर भी चाहा अगर, पीना, तो पीने ना दिया
चैन से हमको कभी...",Chain Se Humko Kabhi,चैन से हमको कभी,1974, Pran Jaye Par Vachan Na Jaye,प्राण जाए पर वचन न जाए,ओ.पी.नय्यर,एस.एच.बिहारी,Asha Bhosle,आशा भोंसले
"मुझसे भला ये काजल तेरा
नैन बसे दिन-रैन
नि सोनिए, नि सोनिए
ओ छोड़ बेदर्दी आँचल मेरा
हो गई मैं बेचैन
वे सोनेया, वे सोनेया

नाम की तू है मेरी सजनिया, नाम का मैं हूँ तेरा पिया
रेशमी लट से खेले ये गजरा, दूर से तरसे मेरा जिया
ना ना, हाँ हाँ
तौबा, तौबा कैसी
नाम है प्रेमी पागल तेरा, तो संग लागे नैन
वे सोनेया, वे सोनेया
मुझसे भला ये...

प्रेम-गली में होगा न बलमा, तुझसा दीवाना और कोई
चैन उड़ाना, नींद चुराना, सीखे ये तुझसे चोर कोई
ना ना, हाँ हाँ
गोरी, क्या है सैंया
हाँ, आप हूँ मैं तो घायल तेरा, तड़पूँ सारी रैन
नि सोनिए, नि सोनिए
छोड़ बेदर्दी आँचल...

चाहे पवन हो, चाहे किरण हो, छूने न दूँगा तेरा बदन
जलता है मन तो, मन में छुपा के, रख ले मुझे तू मेरे सजन
ना ना, हाँ हाँ
रानी, क्या है राजा
हाँ रूप, बरसता बादल तेरा, प्यासे मेरे नैन
नि सोनिए, नि सोनिए
छोड़ बेदर्दी आँचल...",Mujhse Bhala Ye,मुझसे भला ये,1970, The Train,द ट्रेन,आर.डी.बर्मन,आनंद बक्षी,"Md.Rafi,  Lata Mangeshkar","मोहम्मद रफ़ी, लता मंगेशकर"
"हसीन प्यारी भोली, शहद के जैसी मीठी
है नर्म जैसे रुई, नानी माँ
कहानियाँ सुनाती, पहेलियाँ बुझाती
थपक-थपक सुलाती, नानी माँ
तुम्हीं हो मेरी लोरी, तुम्हीं मेरी कहानी
तुम्हारा प्यार बचपन की एक हसीं निशानी
तुम्हीं ने दी थी गुड़िया, जो थी मेरी सहेली
तुम्हारा ही था आँगन, मैं कल थी जिसमें खेली

तुम्हीं ने था बताया है रंग कितने सारे
तुम्हीं ने था बताया है फूल कितने प्यारे
तुम्हीं ने सिखाया बड़ों से कैसे बोलूँ
तुम्हीं ने था सिखाया दुपट्टा कैसे ओढूँ
वो प्यार से बुलाती, वो प्यार से सिखाती
वो कुछ ना कुछ बताती, नानी माँ
तुम्हीं हो मेरी लोरी...

तुम्हीं ने मेरे दिल में, मोहब्बतें हैं घोली
तुम्हीं से तो सुनी थी, जो बोलती हूँ बोली
तुम्हीं ने तो कहा था, जो भूलता नहीं है
हमेशा याद रखना, कि ज़िन्दगी हसीं है
हसीन प्यारी भोली...",Nani Maa,नानी माँ,2001, Moksha,मोक्ष,राजेश रोशन,जावेद अख्तर,"Dominique Cerejo,  Mahalakhsmi Iyer","डोमिनिक सेरेजो, महालक्ष्मी अय्यर"
"जे मैं होणा सी पराई
दस तू ऐ नी पीत क्यूँ पाई, माए

मेहँदी लगा के आई
बिंदिया सजा के आई
चूड़ी खनका के आई
पायल छनका के आई
हो अब गीत मिलन के गाना है
मुझे साजन के घर जाना है
मुझे साजन के घर जाना है...

गुडिया पटोले ऐथे
मेरिया निशानियाँ
यादां रह जाणियाँ

बचपन बीता जवानी आई
साजन का संदेसा लायी
सैयां जी की सेज को जा के
फूलों से महकाना है
मुझे साजन के...

जम्दिया माँ पे आं तो
परायियाँ हो जान्दिया
पिया मर जाणियाँ
पल में नाता तोड़ चली मैं
बाबुल का घर छोड़ चली मैं
अब तो पिया के देस में सारा
जीवन मुझे बिताना है
मुझे साजन के...

बेटी की तक़दीर का लेखा
पढ़ के ममता रोई
किसी ने इसको जनम दिया
और ले जाए इसे कोई

हो सजधज के आये बाराती
लाये घोड़े हाथी
ओ तेरी शादी के मौके पे
मिल के सेहरा गायेंगे
सदा सुहागन रहे तू बन्नो
तुझे दुआएँ दे जायेंगे
आज की रैना, हम लोगों को
झूम-झूम के गाना है
मुझे साजन के...",Mujhe Saajan Ke Ghar,मुझे साजन के घर,2001, Lajja,लज्जा,अनु मलिक,समीर,"Alka Yagnik,  Richa Sharma,  Sonu Nigam","अल्का याग्निक, ऋचा शर्मा, सोनू निगम"
"असलम भाई, मेरे असलम भाई
असलम भाई, असलम भाई, असलम भाई
दुबई का चश्मा, चीन की चड्डी
और ईरानी चाय
असलम भाई...

कच्चा पक्का, ३२०
उधार की बीड़ी हाय

तेरा चेहरा क़यामत है
बॉलीवुड की शामत है
ना तू नंगा, ना तू हकला
ना तू गंजा असलम भाई
हाथ में बस पाँच ऊंगली
हीरो बन जा असलम भाई
माधुरी पछतायेगी, ऐश्वर्या करेगी हाय
असलम भाई...

आँख में तेरी मैजिक है
चेहरा कितना ट्रैजिक है
हाउस फुल के बोट पर तू
मुस्कुराना असलम भाई
माफिया से पंगा लेना
ना कभी ना असलम भाई
आप के बिन सूनी होगी, फ़िल्मी दुनिया हाय
असलम भाई...",Aslam Bhai,असलम भाई,2001, Love Ke Liye Kuch Bhi Karega,लव के लिए कुछ भी करेगा,विशाल भारद्वाज,अब्बास टायरवाला,Sonu Nigam,सोनू निगम
"देवा श्री गणेशा, देवा श्री गणेशा
देवा श्री गणेशा, देवा श्री गणेशा
देवा श्री गणेशा, देवा श्री गणेशा
देवा श्री गणेशा, देवा श्री गणेशा

ज्वाला सी जलती है आँखों में जिसके भी
दिल में तेरा नाम है
परवाह ही क्या उसका आरंभ कैसा है
और कैसा परिणाम है
धरती अंबर सितारे, उसकी नज़रें उतारें
डर भी उससे डरा रे, जिसकी रखवालिया रे
करता साया तेरा
हे देवा श्री गणेशा
देवा श्री गणेशा, देवा श्री गणेशा...

तेरी भक्ति तो वरदान है, जो कमाए वो धनवान है
बिन किनारे की कश्ती है वो, देवा तुझसे जो अन्जान है
यूँ तो मूषक सवारी तेरी, सब पे है पहरेदारी तेरी
पाप की आँधियाँ लाख हों, कभी ज्योती ना हारी तेरी
अपनी तकदीर का वो, खुद सिकंदर हुआ रे
भूल के ये जहां रे, जिस किसी ने यहाँ रे
साथ पाया तेरा
हे देवा श्री गणेशा...

तेरी धूली का टीका किए, देवा जो भक्त तेरा जिए
उसे अमृत का है मोह क्या, हँस के विष का वो प्याला पिए
तेरी महिमा की छाया तले, काल के रथ का पहिया चले
एक चिंगारी प्रतिशोध से, खड़ी रावण की लंका जले
शत्रुओं की कतारें, इक अकेले से हारे
कण भी परबत हुआ रे, श्लोक बन के जहाँ रे
नाम आया तेरा
हे देवा श्री गणेशा...

गणपति बप्पा मोर्या",Deva Shree Ganesha,देवा श्री गणेशा,2012, Agneepath,अग्नीपथ,अजय-अतुल,अमिताभ भट्टाचार्य,Ajay Gogavale,अजय गोगावले
"दुनिया में, लोगों को
धोखा कभी हो जाता है
आँखों ही, आँखों में
यारों का दिल खो जाता है
दुनिया में...

दो दिल दोनो जवां, आँखों का है ये बयाँ
दोनों के दरमियाँ, कोई भी हो ना यहाँ
पर्दा पर्दा हाँ, पर्दा पर्दा हाँ
अपनों से कैसा पर्दा
मोनिका ओ माय डार्लिंग
मोनिका ओ माय डार्लिंग

दिलबर की, फ़ितरत में, धोखा भी है और चाहत भी
जाँ जाए, तो जाए, सोचूँ क्यूँ जब मैंने उलफत की
जाए भी तो कहाँ, दुश्मन है सारा जहां
जिसपे भी हो गुमाँ, कहना तू उसका यहाँ
पर्दा पर्दा हाँ पर्दा...

हलचल सी, हर पल है, बेदाग़ अपनी जवानी है
बेकल मैं, बेकल तू, बेदर्द दिल की कहानी है
उठता दिल से धुआँ, ये दिल है तेरा पता
आजा रह ले यहाँ, जाएगा अब तू कहाँ
पर्दा पर्दा हाँ पर्दा...
मोनिका ओ माय डार्लिंग",Parda,पर्दा,2010, Once Upon a Time in Mumbaai,वन्स अपॉन अ टाइम इन मुंबई,प्रीतम चक्रबर्ती,इरशाद कामिल,"Sunidhi Chauhan,  Rana Mazumdar","सुनिधि चौहान, राणा मजूमदार"
"कह ना सकूँ मैं, इतना प्यार
अरे सहना सकूँ मैं, इतना प्यार
कह ना सकूँ मैं इतना प्यार
इतना प्यार, करता हूँ

सजनी
तेरे उठने पे रूकती है, तकने पे थमती है
मेरी साँसें तेरे ही इशारों पे चलती है
एक पल भी रह ना सकूँ
इतना प्यार करता हूँ
कह ना सकूँ...
सजनी",Keh Na Sakoon,कह ना सकूँ,2010, Guzaarish,गुज़ारिश,संजय लीला भंसाली,विभू पुरी,Shail Hada,शैल हदा
"हाय बिछुआ डस गयो रे
मीठी मीठी होने लगी
मेरे तन-मन में जलन
मुझको बचा ले मेरे सजन
जल्दी से कर तू कोई जतन
हाय, मेरी माँ, मेरी माँ

मैं तो यूँ ही बनी दीवानी
तूने मेरी कदर नहीं की
कभी भूले से भी दिलजानी
तूने मेरी ख़बर नहीं ली
नस-नस में सजन, हुई ऐसी चुभन
लगी ऐसी लगन, टूटे मेरा बदन
मैं मर गई दर्द से
के मेरा बचना मुश्किल है मितवा
हाय बिछुआ डस...

ना तो मारा, ना ज़िंदा छोड़ा
डंक ऐसा लगाया है
प्यार तेरे पे थोड़ा-थोड़ा
मुझे ग़ुस्सा भी आया है
अरे ओ बेवफ़ा, आँखें ना चुरा
कर कोई दवा या कोई दुआ
पछताएगा बाद में
के मेरा बचना मुश्किल है मितवा
हाय बिछुआ डस...",Haay Bichhua Dass Gayo Re,हाय बिछुआ डस गयो रे,1973, Jheel Ke Us Paar,झील के उस पार,राहुल देव बर्मन,आनंद बक्षी,Asha Bhosle,आशा भोंसले
"चल चलें ऐ दिल, करें चल कर
किसी का इन्तज़ार, इन्तज़ार
झील के उस पार
चल चलें ऐ दिल...

शायद कोई परदेसी आ जाए सूने देस में
मिल जाए भगवान मुझको आदमी के भेस में
क्या हो जाए क्या है ऐतबार, झील के उस पार
चल चलें ऐ दिल...

जो इस पार नहीं कोई क्या जाने वो उस पार हो
परबत के पीछे इक सुंदर सपनों का संसार हो
आई हो बहारों पे बहार, झील के उस पार
चल चलें ऐ दिल...",Chal Chalein Ae Dil,चल चलें ऐ दिल,1973, Jheel Ke Us Paar,झील के उस पार,राहुल देव बर्मन,आनंद बक्षी,Lata Mangeshkar,लता मंगेशकर
"अटकन मटकन दही चटाक
छोर पिजन्वा फूर हुई जा
आ रे आ रे कारे कागा
चुन चुन मोती खा रे खा
बूंढन बूंढन बरसे बरसे
धुआँ धुआँ हुई जा रे जा
अटकन मटकन दही...

इश्क़ बरसे बूंदन बूंदन
चढ़े हैं चंपई चंपई रंग
रंगी पायल, रंगा आँचल
रंगी मैं पूरी तेरे रंग
डोले मन ता रा रा रा रा
धिनक धिन ता रा रा रा रा
के अब तो आजा यारा
आजा आजा लागे नहीं मन
अटकन मटकन दही...

हवायें गाती हैं सरगम
घटाएँ बोले ज्यूँ मृदंग
बूँद भी बाजे मंजीरे
धीरे धीरे चमक छमक छम छम
डोले मन ता ना...

साँस चलती रेशम रेशम
आस बढ़ती मद्धम मद्धम
नशे में घूम रही हूँ, झूम रही हूँ
मैं बिजली के संग
डोले मन ता रा...",Ishq Barse,इश्क़ बरसे,2010, Raajneeti,राजनीति,शांतनु मोईत्रा,स्वानंद किरकिरे,"Swanand Kirkire,  Hamsika Iyer,  Pronob Biswas","स्वानंद किरकिरे, हंसिका अय्यर, प्रोनोब बिस्वास"
"अक्खा ये शहर बड़ा, अपनी जेब में पड़ा
खुल्ला राज है बस क्या
उंगली ये ट्रिग्गर पे है, डेरिंग भी जिग़र में है
अपनी ठाठ है बस क्या
ओ अपना टाइम है, ऐश-कैश भी ज़बरदस्त है
अंडरग्राउंड हर चीज़ का, यहाँ बंदोबस्त है
बाबू राव मस्त है मस्त है
मस्त मस्त है...

ओ कल तक तो चार सिक्के ही जेब में खनखना रहे थे
नोटों के बिस्तर आज है
काले धंधे के बाज़ार में जो बिकता कभी नहीं है
अपने सर पे वो ताज़ है
रोके जो कोई अगर, सीधा ठोक दे उधर
छः फुट गाड़ दे बस क्या
उंगली ये ट्रिग्गर पे है, डेरिंग भी जिग़र में है
अपनी ठाठ है बस क्या
ऐ ब्लैक वाइट में, रॉंग राईट सब, एडजस्ट है
अंडरग्राउंड हर चीज़ का यहाँ बंदोबस्त है
बाबू राव मस्त है...

ओ दुनिया ये मतलबी है, बड़ी कमीनी जगह है यारों
माँगे कुछ मिलता है कहाँ
जो चाहे ये वो कॉलर पकड़ के, हम तो निकालते हैं
वट अपना चलता है यहाँ
ओ अपने पैर के तले, सिस्टम सारा ये चले
जी ले फाड़ के बस क्या
उंगली ये ट्रिग्गर पे है, डेरिंग भी जिग़र में है
अपनी ठाठ है बस क्या
पीछे लाइन में है सब खड़े, अपन फर्स्ट है
अंडरग्राउंड हर चीज़ का यहाँ बंदोबस्त है
बाबू राव मस्त है...",Baabu Rao Mast Hai,बाबू राव मस्त है,2010, Once Upon a Time in Mumbaai,वन्स अपॉन अ टाइम इन मुंबई,प्रीतम चक्रबर्ती,अमिताभ भट्टाचार्य,Mika Singh,मीका सिंह
"पा लिया है प्यार तेरा अब नहीं खोना
ओ मेरे सोना, तुम मेरे हो ना
पा लिया है प्यार तेरा अब नहीं खोना
ओ मेरी सोना, तुम मेरी हो ना

बड़ी हसरतों से तुझे देखती हूँ
तेरे दिल में अपनी जगह ढूँढती हूँ
मेरा प्यार तुझसे सदा ये कहेगा
मेरा दिल है तेरा, तेरा ही रहेगा
अच्छा लगता है जानू, फिर से कहो ना
ओ मेरे सोना...

दीवानी हूँ तेरी, तू अपना बना ले
इन आँखों में मेरा, सपना सजा ले
मैं तय कर चुका हूँ, तुझे ही चुनूँगा
कसम है तेरी, तेरा दूल्हा बनूँगा
कब ले के आओगे बारात ये कहो ना
ओ मेरे सोना...",Paa Liya Hai Pyar,पा लिया है प्यार,2001, Kyo Kii Main Jhuth Nahin Bolta,क्योंकि मैं झूठ नहीं बोलता,आनंद राज आनंद,देव कोहली,"Alka Yagnik,  Udit Narayan","अल्का याग्निक, उदित नारायण"
"कौन कहता है मुँह काला है झूठ का
कौन कहता है मुँह काला है झूठ का
ए सच है ये सच, बोलबाला है झूठ का
कौन कहता है...

चाहे देखो दायें, चाहे देखो बाएँ
लोग यहाँ झूठ का डंका बजाएँ
सच के होंठों पे ताला है झूठ का
अरे कौन कहता है...

झूठ बोलने से बात बन जाती है
काम चल जाता है, दाल गल जाती है
तीखा बड़ा मिर्च-मसाला है झूठ का
कौन कहता है...

झूठ बोले जम कर सिक्का जमा ले
झूठी तारीफ़ कर, सबको पटा ले
ए सारा ज़माना मतवाला है झूठ का
कौन कहता है...

झूठ का ये धंधा है, खूब ये है चलता
माल-पानी आज कल, झूठे को है मिलता
हे रंग और ढंग ही निराला है झूठ का
कौन कहता है...

माना इस झूठ की बात है निराली
एक बात और है जो है सुनने वाली
चढ़ता है सूरज ढलता है
ये झूठ ना ज़्यादा चलता है
पल के सुख के खातिर तू
क्यों अपना रंग बदलता है

पल दो पल का उजाला है झूठ का
अरे काला है जी काला मुँह काला है झूठ का",Kaun Kehta Hai,कौन कहता है,2001, Kyo Kii Main Jhuth Nahin Bolta,क्योंकि मैं झूठ नहीं बोलता,आनंद राज आनंद,देव कोहली,Abhijeet,अभिजीत
