Song,SongTitleEnglish,SongTitleHindi,Year,MovieEnglish,MovieHindi,Music Director,Lyricist,SingersEnglish,SingersHindi
"सारी दुनिया की नेमत मुझको मिल गई है
मैंने मांगी जो मन्नत मुझको मिल गयी है
ओ, सारी दुनिया की नेमत...
फासले दरमियाँ से फ़ना हो गए
मेरे ख्वाबों की जन्नत मुझको मिल गयी है
तेरे बिना मैं अधूरा लफ्ज़ हूँ
पढ़ ले मुझे मैं तेरा इश्क हूँ
तेरे बिना मैं...

सजणा, सजणा, सजणा
हो, कहता है दिल ये तुझपे कर लूँ सजदा रे
लगता है चेहरा तेरा जैसे रब का रे
जिस्म-ओ-जाँ दे दूँ तुझको ऐसे अपना रे
देता है जैसे कोई जान का सदका रे
देखो बाहों में आ के
सारी दुनिया भुला के
कहता है लम्हा प्यार का
तेरे बिना मैं...

तू करे अगर इशारा
छोड़ दूँ मैं जहां को
काश बिन कहे तू समझे
मेरे दर्द की ज़ुबाँ को
हो, तू करे अगर इशारा...
हो, चाहत का तू दरिया
जीने का तू ज़रिया
चाहूँ सदा मैं साथ तेरा
तेरे बिना मैं...",Adhura Lafz,अधूरा लफ़्ज़,2018, Baazaar,बाज़ार,सोहेल सेन,जमील अहमद,"Rahat Fateh Ali Khan,  Pratibha Baghel","राहत फ़तेह अली खान, प्रतिभा बघेल"
"सजणा, हाय

तेरे बिन साँस ना लें, मेरे दिन रात
हो, सजणा
खाली खाली लगते हैं, लकीरों वाले हाथ
हो, सजणा

तेरे बिन साँस ना लें, मेरे दिन रात
खाली खाली लगते हैं, लकीरों वाले हाथ
साथ मेरे चलते चलते, हाय
साथ मेरे चलते चलते, रस्ते ना मोड़ीं
नैन ना जोड़ीं कित्ते नैन ना जोड़ीं
नैन ना जोड़ीं कित्ते नैन ना जोड़ीं
तेन्नु वास्ता खुदा दा, हाय
तेन्नु वास्ता खुदा दा, मेरा दिल ना तोड़ीं
नैन ना जोड़ीं कित्ते नैन ना जोड़ीं
नैन ना जोड़ीं कित्ते, हाय

ना किसी अपने ना पराए की तरह
मेरे साथ रहना मेरे साए की तरह
लाज़मी मैं तेरे लिए, तू ज़रूरी मेरे लिए
आँसू ये बिछोड़े वाले, पलकों पे ना छोड़ीं
नैन ना जोड़ीं कित्ते...

आ, सजणा, आ
बिरहा दे रंग जिसनू लग जावाँ
अखियाँ विचों बरसे सावन
लँघ के जिस दी टूट गयी यारी
राह तकदे रह गए साजन

जिस नु इश्क दे गम लगदे ने, हाय
जिस नु इश्क दे गम लगदे
रह जांदी जिंदड़ी थोड़ी
नैन ना जोड़ीं कित्ते...",Nain Na Jodeen,नैन ना जोड़ीं,2018, Badhaai Ho,बधाई हो,रोचक कोहली,कुमार,"Ayushmann Khurrana,  Neha Kakkar","आयुष्मान खुराना, नेहा कक्कड़"
"आजा सोणिये

कैटवाक वाली बेबी है तेरी चाल
बैकलेस सूट विच लगदी कमाल
ओ कित्थे चली जांदी ए (अहा)
ओ कित्थे चली जांदी ए (ओहो)
तेनु पुछणा है इक्को ही सवाल
ओ दस दे कवारीए
या किसे दे तू नाल
क्यों दूरों दूरों जानी ए (अहा )
जान कड्ड जानी ए (ओहो)

एने वि नखरे तू कर ना सोणिये
एने वि नखरे तू कर ना सोणिये
दिल मेरा तेरे लई धड़के
नि आज फिर कित्थे
आज फिर कित्थे
आज फिर कित्थे चल्लीए
मोरनी बणके, मोरनी बणके
आज फिर कित्थे चल्लीए
मोरनी बणके, मोरनी बणके

सण्डे तो लेके सैटरडे तक
सण्डे तो लेके सैटरडे तक
घर दे वेट तेरी खटके
नि आज फिर कित्थे...

(बल्ले बल्ले, बल्ले बल्ले)

जदों नचदी कुड़ी तू बड़ी हॉट लगदी (अहा)
उफ़ हुस्णा दी रानी बाई गॉड लगदी (ओहो)
जदों नचदी कुड़ी तू बड़ी हॉट लगदी
उफ़ हुस्णा दी रानी बाई गॉड लगदी
जदों कोले आक करदीे ए स्माइल कुड़िये
किसे शायर दा वायरल जेहा थॉट लगदी
लक्क नु ऐन्ना लीन करा के
टाइट वाली जीन चढ़ा के
हो गए ने सब झल्ले
नि आज फिर कित्थे...

लगदा तू वी हट्ट के सोणेया
दिल तू लई गया कढ़ के सोणेया
आयी तेरे लई सज्ज धज्ज के
आज फिर कित्थे...

तेरी ओर मैं चल्ली आँ
मोरनी बणके, मोरनी बणके
तेरी ओर मैं चल्ली आँ
मोरनी बणके, मोरनी बणके

(बल्ले बल्ले, बल्ले बल्ले..)
ओये ओये

मैं ऐंवें चल्ली आँ
मोरनी बणके, हा हा हा",Morni Banke,मोरनी बनके,2018, Badhaai Ho,बधाई हो,तनिष्क बागची,मेल्लोड,"Guru Randhawa,  Neha Kakkar","गुरु रंधावा, नेहा कक्कड़"
"वधाईयाँ बीबी तैनू वधाईयाँ नी
वधाईयाँ बीबी तैनू वधाईयाँ नी
वधाईयाँ तेरे ओत नू, तेरे पौत नू
तेरे बाप बनते गौत नू, वधाईयाँ नी
(लग गए)

लो जी लुट गए छुहारे
हो गए हैं वारे न्यारे
तेरे तो छप गए पेपर जी
(हा हा हा)
अब क्या होगा रे प्यारे
खुशियाँ ही जब किक मारे
जायें कहाँ मुँह लेकर जी
(लग गए)
वधाईयाँ बीबी तैनू...

ख़ुशी में ऐसी फूल गयी है
फट ही ना जाए छाती
हवा में फायर किया तो
सर पे गिरा है उड़ता हाथी
ख़ुशी में ऐसी फूल गयी है...

मारी थी मिस कॉल ही लेकिन
हो गया आंसर जी
वधाइयाँ बीबी तैनू",Badhaiyaan Tenu,बधाईयाँ तेनु,2018, Badhaai Ho,बधाई हो,तनिष्क बागची,वायु,"Brijesh Shandailya,  Romy,  Jordan","बृजेश शांडिल्य, रोमी, जॉर्डन"
"तू ही बता, कौन तू है मेरा
कब से तू दिल में, रहता है क्या पता
क्यूँ लागे मुझे, तेरे बिन ज़िन्दगी
एक पल भी कभी, पाएगी ना ख़ुशी
तुझको पहचाना, मैंने तब जाना
के ज़िंदा हूँ मैं
तेरे लिए, सिर्फ तेरे लिए
हर पल रहूँ, मैं सिर्फ तेरे लिए
तेरे लिए, सिर्फ तेरे लिए
हर पल रहूँ, मैं सिर्फ तेरे लिए

छाई सी है जो आरज़ू दिल पे मेरे
क्या वही आरज़ू है तुझको भी घेरे
पल जो संग बीते, उनकी तस्वीरें
रख ले आँखों में यूँ हम दोनों
फिर तू कहीं भी हो, लगे पास ही मुझको
के ज़िंदा हूँ मैं...

की कहा जेड़ी मन दी ऐ गल हाय
तू ते ओ सकदा ऐ पागल
बात मेरी रही अनकही अनसुनी
तू समझ ले सनम
चाहे मैं कहूँ या ना कहूँ, हाय
मैं ते जाणा दिल से तेरी हूँ

कल तक हम दोनों, अजनबी से थे राहों में
आज है तू ही, मेरी साँसों में आहों में
कोई बतलाये, सपने कब छाए
पास कब आये, यूँ हम दोनों
जागा है क्या जादू
बस मैं हूँ और बस तू
के ज़िंदा हूँ मैं...",Tere Liye,तेरे लिए,2018, Namaste England,नमस्ते इंग्लैंड,मनन शाह,जावेद अख्तर,"Atif Aslam,  Akanksha Bhandari","आतिफ़ असलम, आकांक्षा भंडारी"
"(कल्ली ना जाणा...)

भरे बाज़ार बेबी, भरे बाज़ार बेबी
भरे बाज़ार बेबी
कल्ले ना जाणा
नईते शोर मच जायेगा
भरे बाज़ार बेबी
कल्ले ना जाणा
नईते शोर मच जायेगा
हर कोई आशिक, हर कोई आशिक
हर कोई आशिक
तुझे तेरे घर तक
छोड़ने आएगा
भरे बाज़ार बेबी...

हो झगड़ा करा देगी तू
आशिकों के बीच में
फिर भी तू आएगी ना
किसी के भी रीच में
कहती दफ़ा हो जा, कहती दफ़ा हो जा
कहती दफ़ा हो जा
पर बेबी ऐसा कभी
हो नहीं पायेगा
भरे बाज़ार बेबी...

मैं क्या कह रहा था, सुन
बेबी मुझको पता है, तेरा मन है बड़ा
तभी फ्लोर पे, तेरी वेट में हूँ खड़ा
ऐसे बैठे बैठे, तू शोल्डर ना हिला
थोड़ा पैर उठा, सान्नू नाच के वखा
ऐ अँखियों से गोली मारती रहती
दिलो को सूली टांगती रहती
स्कूल-वूल की टीचर है क्या
जब देखो लेक्चर झाड़ती रहती
तेरे लिए लिखा ये गाना
साथ में मेरे गाएगी क्या
घूर-घूर क्यूँ देखे मैडम
अरे खाएगी क्या
अरे खाएगी क्या

हाँ कोई तो बताओ मुझे
क्या मैं करूँ इसका
अपने ड्रम पे है
बस नहीं जिसका
फिर ना तू कहना मुझे, फिर ना तू कहना मुझे
फिर ना तू कहना जब दिल तेरा
पैरों के नीचे मेरे आएगा
भरे बाज़ार बेबी...

तेरी ना मानूँगी मैं
तू है दीवाना हाँ
तू बाज़ ना आएगा

शोर मच जाएगा
बाज़ ना आएगा
शोर मच जाएगा
शोर मच, शोर मच...
शोर मच जाएगा",Bhare Bazaar,भरे बाज़ार,2018, Namaste England,नमस्ते इंग्लैंड,"ऋषि रिच, बादशाह","मास्टर राकेश, बादशाह","Vishal Dadlani,  Badshah,  Payal Dev,  Rishi Rich","विशाल ददलानी, बादशाह, पायल देव, ऋषि रिच"
"मैं यहाँ मैं वहाँ, चाहे जाऊँ जहाँ
पूछता है ये दिल, तू कहाँ, तू कहाँ
मैं सारा जग छोड़ के
निकला हूँ इक तेरे ही वास्ते
दूरियाँ हैं बिछीं रास्ते रास्ते
कितनी भी दूरी हो, कोई मजबूरी हो
मैंने ये ठाना है, तुझको ही पाना है
आ रहा हूँ मैं बन के दीवाना
मान ही लेगा इक दिन ज़माना
तू मेरी, मैं तेरा
तू मेरी, मैं तेरा...

मेरी तन्हाइयाँ कर रही हैं बयाँ
उन दिनों की हसीं दास्ताँ
जब के हम साथ थे, हाथ में हाथ थे
लम्हा लम्हा हसीं था समा
यादें बरसे ना क्यूँ, आँखें तरसे ना क्यूँ
ढूँढती हैं ये तेरा ठिकाना
तू मिले तो है बस ये बताना
तू मेरी मैं तेरा...

ये सफ़र है कठिन, मुश्किलें रात दिन
साये की तरह है साथ मेरे
पाँव ज़ख़्मी सही, दिल को है ज़िद यही
जाना ही है इसे पास तेरे
राह का सूनापन, और तन की थकन
कितने तीरों का मैं हूँ निशाना
फिर भी जाना तो मैंने ये जाना
तू मेरी मैं तेरा...",Tu Meri Main Tera,तू मेरी मैं तेरा,2018, Namaste England,नमस्ते इंग्लैंड,मनन शाह,जावेद अख्तर,"Rahat Fateh Ali Khan,  Altamash Faridi,  Shadab Faridi","राहत फ़तेह अली खान, अल्तमश फ़रीदी, शादाब फ़रीदी"
"प्रॉपर पटोला
नखरा ए स्वैग
सूट पटियाला शाही
चुन्नी तेरी ब्लैक
ओ मुंडे होके परदे
तैनू तक्क तक्क के
नचे जदों हथ तू
लक्के उत्ते रख के

प्रॉपर पटोला
नखरा ए स्वैग
सूट पटियाला शाही
चुन्नी मेरी ब्लैक
ओ मुंडे हो के परदे
मैनु तक्क तक्क के
नचां जदों हथ मैं
लक्के उत्ते रख के

लुक, रब्ब ने हुसना दी रखी कोई थोड़ नी
गल्लां दी लाली नु मेकअप दी कोई लोड नी
फूल ने गुलाब दे, बूल ने जनाब दे
सोंह लग्गे मम्मी दी मैनू
तेरा कोई तोड़ नी
ठोड़ी ते तिल काला कुड़िये नी बतां पावे
सूट पटियाला, गुक्की वुक्की नी मथा पावे
घर तेरा नी मैं आपे लभ लूँ
सान्नू बस दस जा तू नाम
प्रॉपर पटोला...

मैं ला दूँ तुझे हार
पहना दूँ तुझे कंगन
हो तैयार, घुमा दूँ तुझे लंडन
हाथ में रखूँ हाथ रखे जिस चीज़ पे
हीरे जड़वा दूँ तेरी काली कमीज़ पे
आजा मेरे पास, कर गुज़ारिश
पैसे की क्या बात
कर दूँ नोटों की बारिश
इतना ना सोच, हाथ मेरा थाम
तुझे याद रहेगी ज़िन्दगी भर ये शाम

जा मुंडेया वे तेरे बस दी नी गल
ना नाच मेरे नाल आके तू क्लोज़
हाँ चल पतली गली से तू निकल
तेरे जैसों को रखती हूँ ऑन टोज़
क्यों बोले लाई तू
ना करे ट्राई तू
जा जा तू बेटे घर जा
प्रॉपर पटोला...",Proper Patola,प्रॉपर पटोला,2018, Namaste England,नमस्ते इंग्लैंड,बादशाह,बादशाह,"Badshah,  Aastha Gill,  Diljit Dosanjh","दिलजीत दोसांझ, बादशाह, आस्था गिल"
"ज़िद्दी है दिल सुनता नहीं
के मुश्किल है क्या
ज़िद्दी है दिल...

बहलाऊँ मैं, लाख समझाऊँ मैं
मगर दिल हठीला कहे
तुम ही इसकी हो तमन्ना
तुम ही इसकी आरज़ू
दिल है मेरा, इक जज़ीरा
तुम समंदर जानसू
दिल का मैं क्या करूँ
मैं जीयूँ या मरूँ
क्या करूँ क्या करूँ
तुम कहो क्या करूँ

कहता है ये दिल
ज़िन्दगी रात है और तुम रौशनी
रहता है ये दिल
ख़्वाबों की दुनिया में जो है तुमसे बनी
सहता है ये दिल
तुम बिन एक ऐसी रूत जो है तन्हाई की
बहता है ये दिल
दर्द की उस नदी में जो है बह रही
सारी मजबूरियाँ आ गयी है दरमियाँ
मगर दिल हठीला कहे...

सोया है ये दिल
बस तुम्हारे हसीं सपनों की बाहों में
खोया है ये दिल
बीते लम्हों को जाती हुई राहों में
खोया है ये दिल
आज भी उन मोहब्बत भरी बातों में
रोया है ये दिल
याद कर के तुम्हें चांदनी रातों में
गहरी मायूसियाँ छा रही हैं यहाँ
मगर दिल हठीला कहे...",Ziddi Hai Dil,ज़िद्दी है दिल,2018, Namaste England,नमस्ते इंग्लैंड,मनन शाह,गुलज़ार,Mannan Shaah,मनन शाह
"उह, आह
बेबी लेट मी लव यू
उह, आह
बेबी लेट मी किस यू
उह, आह
बेबी लेट मी हग यू
उह, आह
बेबी लेट मी लव यू

इन बाज़ुओं में जो ले लो मुझे
तो चैन शायद मिले
आओ मिटा भी दो अब तो मेरे
तन मन के सारे गिले
मैं हूँ तरसी तरसी
तरसा तरसा है ये मन
क्या कहूँ जानेमन
जलता है क्यूँ ये बदन
उह, आह
बेबी लेट मी लव यू...

देखो धीमे धीमे
हाँ कैसे होश खो गए
हो, तुम तो धीरे धीरे
हाँ बस मेरे हो गए
बेचैनियाँ और मैं हूँ
बेताबियाँ और मैं हूँ
मीठी सी, हर अंग में है थकन
क्या कहूँ जानेमन...

मैं हूँ बावली सी
हाँ तुम भी हो मनचले
हम्म, देखो मिटने ही थे
हाँ जो भी थे फासले
अब ना कोई मैं और ना तुम
इक दूसरे में दोनों गुम
कैसी है, दीवाने दिल की लगन
क्या कहूँ जानेमन...",Kya Kahoon Jaaneman,क्या कहूँ जानेमन,2018, Namaste England,नमस्ते इंग्लैंड,मनन शाह,जावेद अख्तर,Shashaa Tirupati,शाशा तिरुपति
"तुमसे कितना प्यार है
दिल में उतर कर देख लो
ना यकीं आये तो फिर
दिल बदल कर देख लो
तुमसे कितना प्यार...

हमने अपनी हर साँस पर
नाम तेरा लिख दिया
इक तुझे पाने की ख़ातिर
खुद को पागल कर लिया
इश्क़ में तुम भी सनम
हद से गुज़र कर देख लो
तुमसे कितना प्यार...

जाने क्यों सारे जहां से
हो गये है बेख़बर
जब से तुम आँखों में आये
जागती है ये नज़र
अपनी रातों से मेरी
रातें बदल कर देख लो
तुमसे कितना प्यार...",Tumse Kitna Pyaar Hai,तुमसे कितना प्यार है,2002, Company,कंपनी,संदीप चौटा,ताबिश रोमानी,Altaf Raja,अल्ताफ राजा
